country_name,indicator_name,value,year
Sudan,CPIA financial sector rating (1=low to 6=high),2.5,2019
Sudan,GDP per capita (constant LCU),486.401971894814,2019
Sudan,"Net ODA received (% of imports of goods, services and primary income)",14.1166173417033,2019
Sudan,"Net official flows from UN agencies, ILO (current US$)",325100.004673004,2019
Sudan,Oil rents (% of GDP),3.59809441444343,2019
Sudan,Refugee population by country or territory of asylum,1055489.0,2019
Sudan,Adjusted savings: education expenditure (% of GNI),2.18,2019
Sudan,Adjusted savings: mineral depletion (% of GNI),0.0024463887648952,2019
Sudan,Exports of goods and services (constant 2015 US$),459266929.865687,2019
Sudan,"GDP per capita, PPP (current international $)",4350.06606227588,2019
Sudan,Households and NPISHs Final consumption expenditure per capita (constant 2015 US$),551.127307230983,2019
Sudan,"Net bilateral aid flows from DAC donors, Korea, Rep. (current US$)",8210000.03814697,2019
Sudan,"Net financial flows, RDB nonconcessional (NFL, current US$)",0.0,2019
Sudan,"Population, male (% of total population)",49.9564095095169,2019
Sudan,Refugee population by country or territory of origin,734780.0,2019
Sudan,Transport services (% of commercial service imports),71.4381160381477,2019
Sudan,"Vulnerable employment, female (% of female employment) (modeled ILO estimate)",61.8599987030029,2019
Sudan,"Fertility rate, total (births per woman)",4.347,2019
Sudan,"Incidence of HIV, ages 15-24 (per 1,000 uninfected population ages 15-24)",0.1,2019
Sudan,"Mortality rate, neonatal (per 1,000 live births)",27.3,2019
Sudan,People practicing open defecation (% of population),24.11727297,2019
Sudan,"PPG, IDA (DOD, current US$)",1201291000.0,2019
Sudan,Adjusted savings: carbon dioxide damage (% of GNI),2.75066404861129,2019
Sudan,Adjusted savings: gross savings (% of GNI),58.12716532,2019
Sudan,"GNI, PPP (current international $)",174704511943.419,2019
Sudan,Merchandise imports from low- and middle-income economies in East Asia & Pacific (% of total merchandise imports),6.87744958410349,2019
Sudan,Tuberculosis treatment success rate (% of new cases),83.0,2019
Sudan,Claims on other sectors of the domestic economy (annual growth as % of broad money),12.8262615438152,2019
Sudan,CPIA debt policy rating (1=low to 6=high),1.5,2019
Sudan,Domestic general government health expenditure (% of current health expenditure),22.6874733,2019
Sudan,GNI per capita (current LCU),42866.8660068847,2019
Sudan,"Incidence of tuberculosis (per 100,000 people)",67.0,2019
Sudan,"Industry (including construction), value added (% of GDP)",21.7363013265282,2019
Sudan,"Industry (including construction), value added per worker (constant 2015 US$)",8879.33590440149,2019
Sudan,"Net bilateral aid flows from DAC donors, Slovak Republic (current US$)",9999.99977648258,2019
Sudan,Net ODA received (% of gross capital formation),17.3485321124428,2019
Sudan,"Net official flows from UN agencies, WHO (current US$)",2995280.26580811,2019
Sudan,Out-of-pocket expenditure per capita (current US$),31.6222552,2019
Sudan,"Population, female",21425281.0,2019
Sudan,Prevalence of undernourishment (% of population),12.3,2019
Sudan,Total debt service (% of GNI),0.797099078561394,2019
Sudan,"Agriculture, forestry, and fishing, value added (current US$)",5274059390.37433,2019
Sudan,Commercial service exports (current US$),1351788909.30193,2019
Sudan,"External debt stocks, public and publicly guaranteed (PPG) (DOD, current US$)",16309393169.8,2019
Sudan,Imports of goods and services (constant LCU),1159892600.0,2019
Sudan,Net barter terms of trade index (2000 = 100),200.956828,2019
Sudan,"Population ages 00-04, male (% of male population)",14.8169418339929,2019
Sudan,"Population ages 15-64, male (% of male population)",55.8757508197604,2019
Sudan,"Population ages 65 and above, female",831202.0,2019
Sudan,Prevalence of anemia among non-pregnant women (% of women ages 15-49),36.5,2019
Sudan,Gross savings (current LCU),694274043015.047,2019
Sudan,"Insurance and financial services (% of service imports, BoP)",7.48350461436599,2019
Sudan,"Net bilateral aid flows from DAC donors, Sweden (current US$)",42459999.0844727,2019
Sudan,Net domestic credit (current LCU),454123960646.166,2019
Sudan,Net primary income (Net income from abroad) (current US$),-1620113578.87701,2019
Sudan,"Population ages 50-54, male (% of male population)",3.15599115689223,2019
Sudan,"Service exports (BoP, current US$)",1366595698.97677,2019
Sudan,Adjusted net national income (annual % growth),3.44540128282395,2019
Sudan,Discrepancy in expenditure estimate of GDP (constant LCU),344300.0,2019
Sudan,Gross fixed capital formation (current US$),9364884783.42246,2019
Sudan,Gross national expenditure (constant LCU),21810280400.0,2019
Sudan,"Domestic general government health expenditure per capita, PPP (current international $)",46.40389727,2019
Sudan,External health expenditure (% of current health expenditure),6.55756235,2019
Sudan,"Insurance and financial services (% of service exports, BoP)",0.248961874977038,2019
Sudan,Merchandise exports to low- and middle-income economies in Latin America & the Caribbean (% of total merchandise exports),0.00829160414511626,2019
Sudan,"Time required to start a business, female (days)",35.0,2019
Sudan,CPIA fiscal policy rating (1=low to 6=high),2.5,2019
Sudan,"Employers, female (% of female employment) (modeled ILO estimate)",1.62999999523163,2019
Sudan,Final consumption expenditure (constant LCU),21673082200.0,2019
Sudan,"Net financial flows, bilateral (NFL, current US$)",445131724.5,2019
Sudan,"Population ages 10-14, male (% of male population)",12.3955089490553,2019
Sudan,Rural population,27856005.0,2019
Sudan,Adjusted savings: net national savings (% of GNI),40.9195967069525,2019
Sudan,Lower secondary school starting age (years),12.0,2019
Sudan,"Net bilateral aid flows from DAC donors, Slovenia (current US$)",29999.9993294477,2019
Sudan,"PPP conversion factor, GDP (LCU per international $)",10.5049908178352,2019
Sudan,Private credit bureau coverage (% of adults),2.3,2019
Sudan,Sex ratio at birth (male births per female births),1.04,2019
Sudan,Coal rents (% of GDP),0.0,2019
Sudan,Exports of goods and services (% of GDP),0.630574147276582,2019
Sudan,Gross domestic savings (% of GDP),35.8465528377868,2019
Sudan,Gross national expenditure (% of GDP),99.9576857064326,2019
Sudan,Households and NPISHs final consumption expenditure (% of GDP),38.8786049883853,2019
Sudan,"Mortality rate attributed to unintentional poisoning (per 100,000 population)",1.7,2019
Sudan,"Net financial flows, RDB concessional (NFL, current US$)",0.0,2019
Sudan,"Cost to export, border compliance (US$)",966.5,2019
Sudan,Domestic general government health expenditure per capita (current US$),10.64696724,2019
Sudan,Domestic private health expenditure per capita (current US$),33.20448155,2019
Sudan,"GNI per capita, PPP (current international $)",4080.0,2019
Sudan,Number of deaths ages 20-24 years,13039.0,2019
Sudan,"Prevalence of HIV, male (% ages 15-24)",0.1,2019
Sudan,"Primary education, duration (years)",6.0,2019
Sudan,Arms imports (SIPRI trend indicator values),18000000.0,2019
Sudan,"Contributing family workers, total (% of total employment) (modeled ILO estimate)",8.01000022888184,2019
Sudan,"Exports of goods, services and primary income (BoP, current US$)",5203179837.82677,2019
Sudan,GNI: linked series (current LCU),1835269293800.0,2019
Sudan,"IBRD loans and IDA credits (DOD, current US$)",1201291000.0,2019
Sudan,Merchandise imports from economies in the Arab World (% of total merchandise imports),26.2065150381336,2019
Sudan,"Mortality rate, infant, female (per 1,000 live births)",36.1,2019
Sudan,"Net bilateral aid flows from DAC donors, United States (current US$)",275799987.792969,2019
Sudan,"Trademark applications, total",3425.0,2019
Sudan,"Vulnerable employment, total (% of total employment) (modeled ILO estimate)",51.269998550415,2019
Sudan,"Agriculture, forestry, and fishing, value added (% of GDP)",20.1640153484443,2019
Sudan,Antiretroviral therapy coverage for PMTCT (% of pregnant women living with HIV),4.0,2019
Sudan,CPIA trade rating (1=low to 6=high),2.5,2019
Sudan,Gross fixed capital formation (% of GDP),35.8042385442194,2019
Sudan,Merchandise exports by the reporting economy (current US$),6383662205.0,2019
Sudan,Merchandise exports to low- and middle-income economies outside region (% of total merchandise exports),22.5858744980382,2019
Sudan,Net official development assistance received (constant 2018 US$),1651199951.17188,2019
Sudan,Secure Internet servers (per 1 million people),4.29773623517418,2019
Sudan,"Trademark applications, direct resident",1647.0,2019
Sudan,"Employment to population ratio, ages 15-24, female (%) (modeled ILO estimate)",10.6619997024536,2019
Sudan,"Employment to population ratio, ages 15-24, male (%) (modeled ILO estimate)",25.2159996032715,2019
Sudan,"Immunization, DPT (% of children ages 12-23 months)",93.0,2019
Sudan,"Survival to age 65, female (% of cohort)",69.9544316,2019
Sudan,Time required to get electricity (days),70.0,2019
Sudan,GNI (constant 2015 US$),48011633457.7761,2019
Sudan,GNI (current US$),24535685745.9893,2019
Sudan,Gross value added at basic prices (GVA) (current LCU),1556084000000.0,2019
Sudan,"Net official flows from UN agencies, WFP (current US$)",251309.990882874,2019
Sudan,Net secondary income (Net current transfers from abroad) (current US$),1222635385.02674,2019
Sudan,"Population ages 15-19, male (% of male population)",11.097427916908,2019
Sudan,"Adjusted net savings, excluding particulate emission damage (current US$)",11391775731.5298,2019
Sudan,Adjusted savings: particulate emission damage (% of GNI),2.08726780069147,2019
Sudan,Broad money growth (annual %),60.0789296283337,2019
Sudan,"Cost of business start-up procedures, male (% of GNI per capita)",17.8,2019
Sudan,Exports of goods and services (constant LCU),173710800.0,2019
Sudan,External health expenditure per capita (current US$),3.07738781,2019
Sudan,"Goods exports (BoP, current US$)",3734656598.42139,2019
Sudan,"Immunization, HepB3 (% of one-year-old children)",93.0,2019
Sudan,Investment in transport with private participation (current US$),604370000.0,2019
Sudan,Liner shipping connectivity index (maximum value in 2004 = 100),8.9116560094,2019
Sudan,"Net primary income (BoP, current US$)",-1620113578.74618,2019
Sudan,"Portfolio equity, net inflows (BoP, current US$)",0.0,2019
Sudan,"Services, value added per worker (constant 2015 US$)",5535.78614391369,2019
Sudan,Net foreign assets (current LCU),-220616544397.929,2019
Sudan,"Net official flows from UN agencies, UNICEF (current US$)",100535003.662109,2019
Sudan,"Patent applications, residents",238.0,2019
Sudan,"Personal remittances, received (current US$)",522317287.755546,2019
Sudan,"Trademark applications, resident, by count",1647.0,2019
Sudan,Young people (ages 15-24) newly infected with HIV,1000.0,2019
Sudan,External balance on goods and services (constant LCU),-986181800.0,2019
Sudan,GDP (constant LCU),20824442900.0,2019
Sudan,GDP per capita (current US$),610.927861513165,2019
Sudan,GDP per capita growth (annual %),-4.48984342796072,2019
Sudan,Gross domestic savings (current US$),9375952425.13369,2019
Sudan,Gross fixed capital formation (annual % growth),-0.199966393425328,2019
Sudan,"Immunization, measles (% of children ages 12-23 months)",90.0,2019
Sudan,Imports of goods and services (current LCU),11509253400.0,2019
Sudan,"Life expectancy at birth, male (years)",63.467,2019
Sudan,"Population ages 0-14, total",17191958.0,2019
Sudan,"Population ages 20-24, female (% of female population)",9.32817637257593,2019
Sudan,"PPG, official creditors (NFL, current US$)",713624557.4,2019
Sudan,"PPG, other private creditors (NFL, current US$)",0.0,2019
Sudan,"Transport services (% of service imports, BoP)",65.1832305158857,2019
Sudan,Adjusted net national income (constant 2015 US$),47361954122.0402,2019
Sudan,CPIA macroeconomic management rating (1=low to 6=high),1.5,2019
Sudan,"Imports of goods, services and primary income (BoP, current US$)",11508918918.8809,2019
Sudan,Merchandise imports from low- and middle-income economies in Latin America & the Caribbean (% of total merchandise imports),0.439518730046195,2019
Sudan,"Net errors and omissions (BoP, current US$)",647619128.606367,2019
Sudan,GDP deflator: linked series (base year varies by country),9394.98741404506,2019
Sudan,Merchandise exports to low- and middle-income economies in South Asia (% of total merchandise exports),6.49336938090696,2019
Sudan,"Multilateral debt service (TDS, current US$)",55790178.1,2019
Sudan,"Official exchange rate (LCU per US$, period average)",45.7670454545455,2019
Sudan,Prevalence of moderate or severe food insecurity in the population (%),49.4,2019
Sudan,Rural population (% of total population),65.064,2019
Sudan,Taxes less subsidies on products (current US$),5352537292.78075,2019
Sudan,Time to prepare and pay taxes (hours),180.0,2019
Sudan,Adjusted savings: consumption of fixed capital (% of GNI),17.2075686112074,2019
Sudan,Claims on private sector (annual growth as % of broad money),13.0854740004239,2019
Sudan,Current account balance (% of GDP),-18.2744917292001,2019
Sudan,Final consumption expenditure (constant 2015 US$),33189881392.6237,2019
Sudan,"Population ages 15-64, female",12117629.0,2019
Sudan,Taxes less subsidies on products (constant LCU),252068500.0,2019
Sudan,"Agriculture, forestry, and fishing, value added (current LCU)",394499642400.0,2019
Sudan,Final consumption expenditure (annual % growth),-2.19043449725282,2019
Sudan,"Net bilateral aid flows from DAC donors, Ireland (current US$)",5989999.77111816,2019
Sudan,"Net official flows from UN agencies, UNHCR (current US$)",1406230.80730438,2019
Sudan,"Trademark applications, nonresident, by count",3596.0,2019
Sudan,"Adjusted net savings, including particulate emission damage (current US$)",10788708555.945,2019
Sudan,Adjusted savings: consumption of fixed capital (current US$),4971724182.97444,2019
Sudan,Adjusted savings: carbon dioxide damage (current US$),794739993.703243,2019
Sudan,"Employment to population ratio, 15+, male (%) (modeled ILO estimate)",60.0909996032715,2019
Sudan,"Incidence of HIV, all (per 1,000 uninfected population)",0.09,2019
Sudan,"Mortality rate, adult, male (per 1,000 male adults)",242.683,2019
Sudan,Procedures to register property (number),6.0,2019
Sudan,"Suicide mortality rate (per 100,000 population)",3.8,2019
Sudan,"Agriculture, forestry, and fishing, value added per worker (constant 2015 US$)",3885.40970456462,2019
Sudan,"Cause of death, by communicable diseases and maternal, prenatal and nutrition conditions (% of total)",35.5456510407433,2019
Sudan,Container port traffic (TEU: 20 foot equivalent units),469526.0,2019
Sudan,Fixed broadband subscriptions (per 100 people),0.07652306,2019
Sudan,GDP: linked series (current LCU),1956453789500.0,2019
Sudan,Gross domestic income (constant LCU),21894033381.8903,2019
Sudan,"Net bilateral aid flows from DAC donors, Australia (current US$)",3170000.07629395,2019
Sudan,"Portfolio investment, net (BoP, current US$)",36367118.0476741,2019
Sudan,"Prevalence of overweight (modeled estimate, % of children under 5)",2.6,2019
Sudan,Adjusted savings: net forest depletion (% of GNI),0.415176961348047,2019
Sudan,"Net bilateral aid flows from DAC donors, Spain (current US$)",1000000.0,2019
Sudan,"Net official flows from UN agencies, FAO (current US$)",610756.158828735,2019
Sudan,People using at least basic drinking water services (% of population),60.38348683,2019
Sudan,"Unemployment, youth total (% of total labor force ages 15-24) (modeled ILO estimate)",32.7820014953613,2019
Sudan,Aquaculture production (metric tons),10000.0,2018
Sudan,"Multilateral debt service (TDS, current US$)",25500782.0,2018
Sudan,Short-term debt (% of total external debt),25.121,2018
Sudan,"Children out of school, male (% of male primary school age)",30.52712059021,2018
Sudan,Fixed telephone subscriptions (per 100 people),0.327554973,2018
Sudan,Gross capital formation (constant 2015 US$),9190126403.18491,2018
Sudan,"Net official flows from UN agencies, FAO (current US$)",90934.5969557762,2018
Sudan,"School enrollment, primary (gross), gender parity index (GPI)",0.93164998292923,2018
Sudan,"Survival to age 65, female (% of cohort)",69.5758718,2018
Sudan,Terms of trade adjustment (constant LCU),883476740.534687,2018
Sudan,Adults (ages 15-49) newly infected with HIV,2900.0,2018
Sudan,Arable land (hectares per person),0.474220896975738,2018
Sudan,Claims on other sectors of the domestic economy (annual growth as % of broad money),34.2497665574044,2018
Sudan,Final consumption expenditure (constant LCU),22158448500.0,2018
Sudan,"Probability of dying among adolescents ages 15-19 years (per 1,000)",11.0,2018
Sudan,"Time to import, documentary compliance (hours)",132.0,2018
Sudan,"Transport services (% of service exports, BoP)",27.0939703744133,2018
Sudan,Adjusted savings: mineral depletion (% of GNI),0.000141116424272042,2018
Sudan,Agricultural nitrous oxide emissions (thousand metric tons of CO2 equivalent),28150.0,2018
Sudan,Arms imports (SIPRI trend indicator values),34000000.0,2018
Sudan,Gross savings (current US$),9907615246.66278,2018
Sudan,Households and NPISHs Final consumption expenditure (constant LCU),19296183500.0,2018
Sudan,"International tourism, receipts (current US$)",1043000000.0,2018
Sudan,Land area (sq. km),1849233.715,2018
Sudan,Merchandise imports from low- and middle-income economies within region (% of total merchandise imports),3.76342040021919,2018
Sudan,"Mortality rate, under-5, male (per 1,000 live births)",65.1,2018
Sudan,Net primary income (Net income from abroad) (current US$),-1812341931.76471,2018
Sudan,Population in urban agglomerations of more than 1 million (% of total population),13.2389382283884,2018
Sudan,Public credit registry coverage (% of adults),0.0,2018
Sudan,Surface area (sq. km),1854105.405,2018
Sudan,"Unemployment, female (% of female labor force) (modeled ILO estimate)",28.632999420166,2018
Sudan,Adjusted savings: natural resources depletion (% of GNI),0.879190267556858,2018
Sudan,Gross capital formation (% of GDP),36.7100639298114,2018
Sudan,Gross national expenditure (constant LCU),22295921600.0,2018
Sudan,Imports of goods and services (annual % growth),2.40000279966353,2018
Sudan,"Industry (including construction), value added (current LCU)",273405881500.0,2018
Sudan,Population ages 15-64 (% of total population),55.9100476051919,2018
Sudan,"Population ages 15-64, female",11771161.0,2018
Sudan,"Transport services (% of service imports, BoP)",66.9922789717714,2018
Sudan,Fixed broadband subscriptions (per 100 people),0.075002034,2018
Sudan,"Population ages 60-64, female (% of female population)",2.03012955755637,2018
Sudan,Commercial service imports (current US$),1062981731.22239,2018
Sudan,Container port traffic (TEU: 20 foot equivalent units),451712.0,2018
Sudan,Labor tax and contributions (% of commercial profits),19.2,2018
Sudan,"Population, total",41801532.0,2018
Sudan,"Suicide mortality rate, male (per 100,000 male population)",4.9,2018
Sudan,CO2 emissions (kg per PPP $ of GDP),0.107993421994353,2018
Sudan,"Cost of business start-up procedures, male (% of GNI per capita)",20.9,2018
Sudan,GDP per capita (current US$),740.746767001408,2018
Sudan,Import volume index (2000 = 100),350.5166461,2018
Sudan,"Labor force participation rate for ages 15-24, female (%) (modeled ILO estimate)",18.6469993591309,2018
Sudan,"Net bilateral aid flows from DAC donors, Portugal (current US$)",230000.004172325,2018
Sudan,"Net primary income (BoP, current US$)",-1812341931.82223,2018
Sudan,"Population ages 05-09, female (% of female population)",13.2742505396359,2018
Sudan,Population in the largest city (% of urban population),38.2164366036418,2018
Sudan,"Wage and salaried workers, female (% of female employment) (modeled ILO estimate)",35.9599990844727,2018
Sudan,"Computer, communications and other services (% of commercial service exports)",2.03756120784317,2018
Sudan,Domestic credit to private sector by banks (% of GDP),9.35475603325025,2018
Sudan,"Employment to population ratio, ages 15-24, total (%) (modeled ILO estimate)",18.4290008544922,2018
Sudan,Exports of goods and services (constant LCU),162498400.0,2018
Sudan,GNI: linked series (current LCU),1238960329500.0,2018
Sudan,"Labor force participation rate, female (% of female population ages 15-64) (modeled ILO estimate)",30.34,2018
Sudan,Merchandise imports from low- and middle-income economies in South Asia (% of total merchandise imports),11.5818977576235,2018
Sudan,Methodology assessment of statistical capacity (scale 0 - 100),50.0,2018
Sudan,Number of neonatal deaths,37478.0,2018
Sudan,"Population, female",20920586.0,2018
Sudan,"Start-up procedures to register a business, male (number)",9.0,2018
Sudan,Adjusted net national income (current US$),26511727444.1254,2018
Sudan,Adjusted savings: net forest depletion (% of GNI),0.413847799450226,2018
Sudan,GNI per capita (current LCU),29639.1129755723,2018
Sudan,"Goods exports (BoP, current US$)",3484681534.2682,2018
Sudan,Gross capital formation (constant LCU),137473100.0,2018
Sudan,Gross value added at basic prices (GVA) (constant LCU),21030470900.0,2018
Sudan,Net barter terms of trade index (2000 = 100),188.8592102,2018
Sudan,"Net financial flows, RDB concessional (NFL, current US$)",0.0,2018
Sudan,Net secondary income (Net current transfers from abroad) (current LCU),15957438100.0,2018
Sudan,Nitrous oxide emissions in energy sector (thousand metric tons of CO2 equivalent),940.0,2018
Sudan,Primary government expenditures as a proportion of original approved budget (%),122.434930215013,2018
Sudan,Ratio of female to male labor force participation rate (%) (modeled ILO estimate),42.4890383585354,2018
Sudan,Broad money (% of GDP),32.7348735102294,2018
Sudan,CO2 emissions (kg per 2017 PPP $ of GDP),0.110586323660925,2018
Sudan,"External health expenditure per capita, PPP (current international $)",15.60215976,2018
Sudan,Insurance and financial services (% of commercial service imports),6.74477643512147,2018
Sudan,"Population ages 10-14, female (% of female population)",12.1331018165552,2018
Sudan,"Population ages 70-74, male (% of male population)",0.939406672475471,2018
Sudan,Statistical performance indicators (SPI): Pillar 5 data infrastructure score (scale 0-100),15.0,2018
Sudan,"Unemployment, youth male (% of male labor force ages 15-24) (modeled ILO estimate)",27.9309997558594,2018
Sudan,Adjusted net national income per capita (current US$),634.228607796609,2018
Sudan,Agricultural land (sq. km),681861.6,2018
Sudan,Procedures to register property (number),6.0,2018
Sudan,"Time to export, border compliance (hours)",180.0,2018
Sudan,Women Business and the Law Index Score (scale 1-100),29.375,2018
Sudan,Adjusted net national income (annual % growth),-14.2447766488255,2018
Sudan,Coal rents (% of GDP),0.0,2018
Sudan,Final consumption expenditure (current LCU),833843150000.0,2018
Sudan,Prevalence of moderate or severe food insecurity in the population (%),48.9,2018
Sudan,Adjusted savings: particulate emission damage (current US$),661719271.267422,2018
Sudan,"Adolescents out of school, female (% of female lower secondary school age)",35.4924201965332,2018
Sudan,"Human capital index (HCI), female, lower bound (scale 0-1)",0.368335247039795,2018
Sudan,"Incidence of malaria (per 1,000 population at risk)",46.7519228721091,2018
Sudan,"Industry (including construction), value added (annual % growth)",-1.90000004931726,2018
Sudan,"Literacy rate, adult female (% of females ages 15 and above)",56.0632286071777,2018
Sudan,"Mortality rate attributed to unintentional poisoning (per 100,000 population)",1.9,2018
Sudan,"Net bilateral aid flows from DAC donors, Sweden (current US$)",38479999.5422363,2018
Sudan,"Population ages 0-14, male",8584824.0,2018
Sudan,"Prevalence of HIV, male (% ages 15-24)",0.1,2018
Sudan,Public and publicly guaranteed debt service (% of GNI),0.715472326186373,2018
Sudan,"School enrollment, primary (% gross)",78.9529037475586,2018
Sudan,"Service imports (BoP, current US$)",1172241042.73428,2018
Sudan,"Exports of goods and services (BoP, current US$)",4995707338.38466,2018
Sudan,"Households and NPISHs Final consumption expenditure, PPP (current international $)",61935634694.6838,2018
Sudan,"Inflation, consumer prices (annual %)",63.2925073455883,2018
Sudan,Merchandise imports from low- and middle-income economies in Latin America & the Caribbean (% of total merchandise imports),0.483559281262516,2018
Sudan,"Net official flows from UN agencies, IFAD (current US$)",5503250.12207031,2018
Sudan,"Plant species (higher), threatened",17.0,2018
Sudan,"Population ages 15-64, male (% of male population)",55.5534888122406,2018
Sudan,Procedures to build a warehouse (number),16.0,2018
Sudan,Domestic general government health expenditure (% of general government expenditure),5.82834291,2018
Sudan,GDP growth (annual %),-2.6809305497999,2018
Sudan,"Internally displaced persons, new displacement associated with conflict and violence (number of cases)",41000.0,2018
Sudan,"Mortality caused by road traffic injury (per 100,000 population)",26.1,2018
Sudan,Adjusted savings: carbon dioxide damage (% of GNI),2.40109285972477,2018
Sudan,"Employment to population ratio, 15+, total (%) (modeled ILO estimate)",40.5169982910156,2018
Sudan,"Industrial design applications, nonresident, by count",47.0,2018
Sudan,"Industry (including construction), value added (current US$)",6433079564.70588,2018
Sudan,"Lower secondary completion rate, female (% of relevant age group)",50.3767700195313,2018
Sudan,Net foreign assets (current LCU),-222529391128.708,2018
Sudan,Out-of-pocket expenditure (% of current health expenditure),66.95339966,2018
Sudan,Rural population (% of total population),65.358,2018
Sudan,Marine protected areas (% of territorial waters),15.9643552354566,2018
