country_name,indicator_name,value,year
Sudan,Price level ratio of PPP conversion factor (GDP) to market exchange rate,0.140441053714374,2019
Sudan,"Secondary income, other sectors, payments (BoP, current US$)",448311864.305436,2019
Sudan,Adults (ages 15+) and children (ages 0-14) newly infected with HIV,3800.0,2019
Sudan,Employment in agriculture (% of total employment) (modeled ILO estimate),38.3699989318848,2019
Sudan,GNI growth (annual %),-2.55802474891964,2019
Sudan,"PPP conversion factor, private consumption (LCU per international $)",12.7102314395997,2019
Sudan,"Cost to export, documentary compliance (US$)",427.5,2019
Sudan,CPIA public sector management and institutions cluster average (1=low to 6=high),2.1,2019
Sudan,"Exports of goods and services (BoP, current US$)",5101252297.39815,2019
Sudan,Forest area (% of land area),10.021291440709,2019
Sudan,Land area (sq. km),1849233.715,2019
Sudan,"Net official flows from UN agencies, UNAIDS (current US$)",255335.837602615,2019
Sudan,"People using at least basic sanitation services, rural (% of rural population)",24.2340969,2019
Sudan,Periodicity and timeliness assessment of statistical capacity (scale 0 - 100),93.3333,2019
Sudan,Population in urban agglomerations of more than 1 million,5677921.0,2019
Sudan,"Prevalence of HIV, female (% ages 15-24)",0.1,2019
Sudan,"Start-up procedures to register a business, male (number)",9.0,2019
Sudan,Statistical performance indicators (SPI): Pillar 3 data products score  (scale 0-100),55.65625,2019
Sudan,Time to resolve insolvency (years),2.0,2019
Sudan,Adjusted savings: mineral depletion (current US$),706826.772462481,2019
Sudan,Gross capital formation (% of GDP),35.8042385442194,2019
Sudan,"Mortality rate, adult, female (per 1,000 female adults)",184.81,2019
Sudan,"Net bilateral aid flows from DAC donors, Norway (current US$)",11750000.0,2019
Sudan,"Net official flows from UN agencies, IFAD (current US$)",-624617.874622345,2019
Sudan,"Services, value added (current LCU)",736323666700.0,2019
Sudan,"Time to export, border compliance (hours)",180.0,2019
Sudan,"Travel services (% of service imports, BoP)",0.798874723236843,2019
Sudan,Adjusted savings: net national savings (current US$),11822759688.0256,2019
Sudan,CPIA economic management cluster average (1=low to 6=high),1.83333333333333,2019
Sudan,CPIA structural policies cluster average (1=low to 6=high),2.5,2019
Sudan,GDP per capita (constant 2015 US$),1198.51786673816,2019
Sudan,"Inflation, GDP deflator (annual %)",51.9788933465452,2019
Sudan,"Population ages 05-09, female (% of female population)",13.145843921487,2019
Sudan,"Population, female (% of total population)",50.0435904904831,2019
Sudan,Prevalence of anemia among children (% of children ages 6-59 months),50.8,2019
Sudan,"Vulnerable employment, male (% of male employment) (modeled ILO estimate)",47.539999961853,2019
Sudan,"Air transport, freight (million ton-km)",0.0755,2019
Sudan,Domestic general government health expenditure (% of general government expenditure),5.55958939,2019
Sudan,GNI per capita (constant 2015 US$),1121.42030881188,2019
Sudan,Gross national expenditure (current US$),26144731683.1551,2019
Sudan,Merchandise exports to economies in the Arab World (% of total merchandise exports),59.6412290897526,2019
Sudan,Merchandise exports to low- and middle-income economies within region (% of total merchandise exports),0.984616227825607,2019
Sudan,"People using at least basic drinking water services, urban (% of urban population)",73.76365956,2019
Sudan,"Personal transfers, receipts (BoP, current US$)",422947659.060653,2019
Sudan,Population growth (annual %),2.39143408960219,2019
Sudan,"Public and publicly guaranteed debt service (% of exports of goods, services and primary income)",3.43581297152835,2019
Sudan,Start-up procedures to register a business (number),10.0,2019
Sudan,"Employment in industry, female (% of female employment) (modeled ILO estimate)",4.69000005722046,2019
Sudan,Fixed telephone subscriptions,137842.0,2019
Sudan,GNI per capita (constant LCU),454.8341616776,2019
Sudan,"GNI per capita, PPP (constant 2017 international $)",3909.86033569295,2019
Sudan,Gross savings (% of GNI),37.8295460704584,2019
Sudan,"Households and NPISHs Final consumption expenditure, PPP (current international $)",59844853668.8452,2019
Sudan,Military expenditure (current LCU),33088000000.0,2019
Sudan,"Mortality rate, under-5 (per 1,000 live births)",58.4,2019
Sudan,Net official development assistance and official aid received (current US$),1624670043.94531,2019
Sudan,"Population ages 0-14, male (% of male population)",40.7496209548963,2019
Sudan,"Population ages 20-24, male (% of male population)",9.54006544617915,2019
Sudan,Bank liquid reserves to bank assets ratio (%),77.3591946420872,2019
Sudan,Imports of goods and services (% of GDP),0.588271159879598,2019
Sudan,"Labor force participation rate, female (% of female population ages 15-64) (modeled ILO estimate)",30.6,2019
Sudan,"Labor force participation rate, total (% of total population ages 15-64) (modeled ILO estimate)",49.74,2019
Sudan,"Life expectancy at birth, total (years)",65.311,2019
Sudan,Merchandise exports to low- and middle-income economies in Sub-Saharan Africa (% of total merchandise exports),0.984616227825607,2019
Sudan,Military expenditure (current USD),722256177.420763,2019
Sudan,"Net bilateral aid flows from DAC donors, Total (current US$)",693979989.260436,2019
Sudan,"Net capital account (BoP, current US$)",188245039.54248,2019
Sudan,"Population ages 65-69, male (% of male population)",1.41093426599531,2019
Sudan,"PPG, private creditors (NFL, current US$)",0.0,2019
Sudan,"Air transport, passengers carried",530001.0,2019
Sudan,"Debt service on external debt, public and publicly guaranteed (PPG) (TDS, current US$)",178771527.8,2019
Sudan,Gross national expenditure (constant 2015 US$),42361630631.489,2019
Sudan,"People using at least basic sanitation services, urban (% of urban population)",60.14022363,2019
Sudan,"Population ages 55-59, male (% of male population)",2.46123565992,2019
Sudan,"Population ages 70-74, female (% of female population)",1.08232419448781,2019
Sudan,"Unemployment, male (% of male labor force) (modeled ILO estimate)",12.9020004272461,2019
Sudan,External balance on goods and services (% of GDP),0.042302987396984,2019
Sudan,"IFC, private nonguaranteed (NFL, current US$)",0.0,2019
Sudan,"Incidence of HIV, ages 15-49 (per 1,000 uninfected population ages 15-49)",0.15,2019
Sudan,"Mortality from CVD, cancer, diabetes or CRD between exact ages 30 and 70, male (%)",24.3,2019
Sudan,Multilateral debt service (% of public and publicly guaranteed debt service),31.2075299610434,2019
Sudan,Claims on central government (annual growth as % of broad money),20.690425897585,2019
Sudan,Employment in industry (% of total employment) (modeled ILO estimate),16.8199996948242,2019
Sudan,"GNI per capita, Atlas method (current US$)",690.0,2019
Sudan,"Net bilateral aid flows from DAC donors, Portugal (current US$)",119999.997317791,2019
Sudan,Source data assessment of statistical capacity (scale 0 - 100),70.0,2019
Sudan,Trade (% of GDP),1.21884530715618,2019
Sudan,Adjusted net national income (current US$),23654831240.185,2019
Sudan,General government final consumption expenditure (current LCU),494490607500.0,2019
Sudan,Gross national expenditure deflator (base year varies by country),8966.5327269245,2019
Sudan,Gross value added at basic prices (GVA) (constant 2015 US$),49463028138.3128,2019
Sudan,"Net bilateral aid flows from DAC donors, United Kingdom (current US$)",118980003.356934,2019
Sudan,"Population ages 00-04, female (% of female population)",14.3615432628398,2019
Sudan,"Survival to age 65, male (% of cohort)",62.5102802,2019
Sudan,"Trademark applications, direct nonresident",1778.0,2019
Sudan,Ease of doing business rank (1=most business-friendly regulations),171.0,2019
Sudan,General government final consumption expenditure (constant LCU),2550564300.0,2019
Sudan,"Industry (including construction), value added (annual % growth)",-0.70000010724786,2019
Sudan,Labor tax and contributions (% of commercial profits),19.2,2019
Sudan,Mineral rents (% of GDP),0.00284151526725821,2019
Sudan,"Mortality rate attributed to unintentional poisoning, male (per 100,000 male population)",2.0,2019
Sudan,Secure Internet servers,184.0,2019
Sudan,"Services, value added (current US$)",9843899287.43316,2019
Sudan,"Current account balance (BoP, current US$)",-4779839384.32886,2019
Sudan,"Debt service (PPG and IMF only, % of exports of goods, services and primary income)",3.68691321421104,2019
Sudan,Export volume index (2000 = 100),72.60090084,2019
Sudan,"Net bilateral aid flows from DAC donors, Denmark (current US$)",1049999.95231628,2019
Sudan,"Net secondary income (BoP, current US$)",1525899696.72523,2019
Sudan,"Population ages 50-54, female (% of female population)",3.28527779869025,2019
Sudan,Taxes less subsidies on products (current LCU),400369789500.0,2019
Sudan,Time required to register property (days),11.0,2019
Sudan,"Time to import, documentary compliance (hours)",132.0,2019
Sudan,Commercial service imports (current US$),1300599202.35298,2019
Sudan,Gross domestic savings (current LCU),701321241400.0,2019
Sudan,"Net bilateral aid flows from DAC donors, Canada (current US$)",11689999.5803833,2019
Sudan,Prevalence of severe food insecurity in the population (%),16.8,2019
Sudan,Adjusted savings: particulate emission damage (current US$),603067175.58475,2019
Sudan,Gross fixed capital formation (constant LCU),137198200.0,2019
Sudan,Households and NPISHs Final consumption expenditure (constant 2015 US$),23595544021.6519,2019
Sudan,Number of deaths ages 15-19 years,10144.0,2019
Sudan,"Population ages 55-59, female (% of female population)",2.61363199857215,2019
Sudan,"Secondary income receipts (BoP, current US$)",2001880185.68842,2019
Sudan,"Use of IMF credit (DOD, current US$)",528204801.9,2019
Sudan,"CPIA transparency, accountability, and corruption in the public sector rating (1=low to 6=high)",1.5,2019
Sudan,Gross value added at basic prices (GVA) (constant LCU),20572374400.0,2019
Sudan,Merchandise imports from low- and middle-income economies in Europe & Central Asia (% of total merchandise imports),11.0204432292391,2019
Sudan,"Net bilateral aid flows from DAC donors, Japan (current US$)",28129999.1607666,2019
Sudan,Public and publicly guaranteed debt service (% of GNI),0.728618428075615,2019
Sudan,Strength of legal rights index (0=weak to 12=strong),3.0,2019
Sudan,CPIA business regulatory environment rating (1=low to 6=high),2.5,2019
Sudan,Exports of goods and services (current LCU),12336891800.0,2019
Sudan,Merchandise exports to low- and middle-income economies in Europe & Central Asia (% of total merchandise exports),2.10261582912187,2019
Sudan,Mobile cellular subscriptions (per 100 people),77.11203717,2019
Sudan,"Personal remittances, paid (current US$)",138816458.193823,2019
Sudan,GNI (current LCU),1835269293800.0,2019
Sudan,Military expenditure (% of general government expenditure),8.73432991840603,2019
Sudan,Population in largest city,5677921.0,2019
Sudan,"Population, male",21387956.0,2019
Sudan,Adjusted savings: natural resources depletion (% of GNI),0.92100880547174,2019
Sudan,CPIA equity of public resource use rating (1=low to 6=high),2.5,2019
Sudan,Employment in services (% of total employment) (modeled ILO estimate),44.810001373291,2019
Sudan,GNI (constant LCU),19472922759.5994,2019
Sudan,"Grants, excluding technical cooperation (BoP, current US$)",1257720000.0,2019
Sudan,Net official development assistance received (current US$),1624670043.94531,2019
Sudan,Number of deaths ages 5-9 years,6607.0,2019
Sudan,"Population ages 30-34, male (% of male population)",6.30335128798657,2019
Sudan,Business extent of disclosure index (0=less disclosure to 10=more disclosure),3.0,2019
Sudan,CPIA social protection rating (1=low to 6=high),2.5,2019
Sudan,Gross value added at basic prices (GVA) (current US$),20803262032.0856,2019
Sudan,Households and NPISHs final consumption expenditure: linked series (current LCU),760641940600.0,2019
Sudan,"Industry (including construction), value added (constant 2015 US$)",8284582130.96733,2019
Sudan,"Population ages 0-14, female",8476450.0,2019
Sudan,"Cause of death, by injury (% of total)",10.5091032751335,2019
Sudan,Final consumption expenditure (% of GDP),64.1534471622132,2019
Sudan,"Households and NPISHs Final consumption expenditure, PPP (constant 2017 international $)",66381617473.879,2019
Sudan,IDA resource allocation index (1=low to 6=high),2.23333333333333,2019
Sudan,"Internally displaced persons, new displacement associated with conflict and violence (number of cases)",84000.0,2019
Sudan,Monetary Sector credit to private sector (% GDP),9.17361614121809,2019
Sudan,"Net bilateral aid flows from DAC donors, Hungary (current US$)",330000.013113022,2019
Sudan,"Primary income payments (BoP, current US$)",1722041119.1748,2019
Sudan,"Cost of business start-up procedures, female (% of GNI per capita)",17.8,2019
Sudan,Discrepancy in expenditure estimate of GDP (current LCU),221200.0,2019
Sudan,Gross capital formation (constant 2015 US$),9171749238.86523,2019
Sudan,Merchandise imports by the reporting economy (current US$),10344628998.0,2019
Sudan,"Net official flows from UN agencies, UNDP (current US$)",2520070.07598877,2019
Sudan,"Unemployment, female (% of female labor force) (modeled ILO estimate)",28.5130004882813,2019
Sudan,"Adjusted net savings, excluding particulate emission damage (% of GNI)",39.4279238528695,2019
Sudan,"Claims on central government, etc. (% GDP)",11.4906698228619,2019
Sudan,"Compulsory education, duration (years)",8.0,2019
Sudan,Households and NPISHs Final consumption expenditure (current LCU),760641940600.0,2019
Sudan,"IMF repurchases and charges (TDS, current US$)",13065197.2,2019
Sudan,Ratio of female to male labor force participation rate (%) (modeled ILO estimate),42.8296051308212,2019
Sudan,Women's share of population ages 15+ living with HIV (%),48.2,2019
Sudan,"Air transport, registered carrier departures worldwide",3116.0,2019
Sudan,"Computer, communications and other services (% of commercial service imports)",19.4847398634568,2019
Sudan,"Foreign direct investment, net inflows (% of GDP)",3.15553343279251,2019
Sudan,Merchandise exports (current US$),3735000000.0,2019
Sudan,"Prevalence of stunting, height for age (modeled estimate, % of children under 5)",34.1,2019
Sudan,"Self-employed, female (% of female employment) (modeled ILO estimate)",63.4900016784668,2019
Sudan,"Unemployment, youth female (% of female labor force ages 15-24) (modeled ILO estimate)",41.8320007324219,2019
Sudan,"Imports of goods and services (BoP, current US$)",9786877799.70607,2019
Sudan,"Labor force, female (% of total labor force)",30.4412652841804,2019
Sudan,Merchandise exports to low- and middle-income economies in Middle East & North Africa (% of total merchandise exports),12.2321000536086,2019
Sudan,GDP (constant 2015 US$),51312429477.3951,2019
Sudan,Imports of goods and services (current US$),153867024.064171,2019
Sudan,"Inflation, GDP deflator: linked series (annual %)",51.9788933465452,2019
Sudan,"Short-term debt (% of exports of goods, services and primary income)",104.295662076646,2019
Sudan,"Cost to import, documentary compliance (US$)",420.0,2019
Sudan,"Foreign direct investment, net outflows (BoP, current US$)",0.0,2019
Sudan,GDP (current US$),26155799324.8663,2019
Sudan,"GDP per capita, PPP (constant 2017 international $)",4173.56620606463,2019
Sudan,"Net financial flows, multilateral (NFL, current US$)",268493000.0,2019
Sudan,"People practicing open defecation, rural (% of rural population)",36.17518999,2019
Sudan,"Population ages 05-09, male (% of male population)",13.5371701718481,2019
Sudan,CPIA property rights and rule-based governance rating (1=low to 6=high),2.0,2019
Sudan,Number of neonatal deaths,37269.0,2019
Sudan,"Population ages 65 and above, female (% of female population)",3.87953838271713,2019
Sudan,"Population ages 65 and above, male",721764.0,2019
Sudan,"Unemployment, youth male (% of male labor force ages 15-24) (modeled ILO estimate)",28.1590003967285,2019
Sudan,Age dependency ratio (% of working-age population),77.8822124879826,2019
Sudan,Households and NPISHs Final consumption expenditure (current US$),10169009901.0695,2019
Sudan,"Population ages 15-64, female (% of female population)",56.5576199444012,2019
Sudan,"Population ages 35-39, male (% of male population)",5.33282843858478,2019
Sudan,"Population ages 45-49, male (% of male population)",3.77323106518454,2019
Sudan,"Population ages 65 and above, male (% of male population)",3.37462822534327,2019
Sudan,Statistical performance indicators (SPI): Overall score (scale 0-100),39.16125,2019
Sudan,Statistical performance indicators (SPI): Pillar 1 data use score (scale 0-100),53.4,2019
Sudan,"Suicide mortality rate, female (per 100,000 female population)",2.8,2019
Sudan,"GNI, Atlas method (current US$)",29534214202.3377,2019
Sudan,Gross capital formation (current US$),9364884783.42246,2019
Sudan,"Labor force, total",12569287.0,2019
Sudan,"Population ages 65-69, female (% of female population)",1.56041360671069,2019
Sudan,Risk of catastrophic expenditure for surgical care (% of people at risk),70.8,2019
Sudan,"Services, value added (% of GDP)",37.6356278206897,2019
Sudan,"Employment to population ratio, ages 15-24, total (%) (modeled ILO estimate)",18.0200004577637,2019
Sudan,"External health expenditure per capita, PPP (current international $)",13.41253192,2019
Sudan,Gross fixed capital formation (current LCU),700493381800.0,2019
Sudan,Methodology assessment of statistical capacity (scale 0 - 100),50.0,2019
Sudan,"Net financial flows, IMF nonconcessional (NFL, current US$)",-10622381.1,2019
Sudan,Population in urban agglomerations of more than 1 million (% of total population),13.262068925085,2019
Sudan,Time required to enforce a contract (days),810.0,2019
Sudan,Urban population (% of total population),34.936,2019
Sudan,Broad money (current LCU),689597585546.461,2019
Sudan,"Domestic private health expenditure per capita, PPP (current international $)",144.71889655,2019
Sudan,External debt stocks (% of GNI),90.7424763387321,2019
Sudan,GDP per capita (current LCU),45697.4040411847,2019
Sudan,"Labor force participation rate for ages 15-24, female (%) (modeled ILO estimate)",18.3299999237061,2019
Sudan,"Population ages 60-64, male (% of male population)",1.89230331313567,2019
Sudan,"Population, total",42813237.0,2019
Sudan,Statistical performance indicators (SPI): Pillar 5 data infrastructure score (scale 0-100),10.0,2019
Sudan,"Population ages 25-29, male (% of male population)",7.87141136815505,2019
Sudan,"PPG, commercial banks (NFL, current US$)",0.0,2019
Sudan,Adjusted savings: net forest depletion (current US$),119955665.18349,2019
Sudan,Exports of goods and services (current US$),164931708.55615,2019
Sudan,"External debt stocks, total (DOD, current US$)",22264288832.6,2019
Sudan,"GDP, PPP (constant 2017 international $)",178683879115.436,2019
Sudan,Households and NPISHs Final consumption expenditure per capita growth (annual %),-3.24179803651641,2019
Sudan,Terms of trade adjustment (constant LCU),1069590481.89033,2019
Sudan,Forest rents (% of GDP),2.24065080607649,2019
Sudan,"GDP, PPP (current international $)",186240409289.874,2019
Sudan,Gross capital formation (constant LCU),137198200.0,2019
Sudan,"ICT service exports (BoP, current US$)",121054.906112069,2019
Sudan,"Mortality rate attributed to unintentional poisoning, female (per 100,000 female population)",1.4,2019
Sudan,"Population ages 30-34, female (% of female population)",6.38506444792953,2019
Sudan,CPIA gender equality rating (1=low to 6=high),2.5,2019
Sudan,Domestic credit to private sector by banks (% of GDP),9.17361614121809,2019
Sudan,"Inflation, consumer prices (annual %)",50.9940515002971,2019
Sudan,Military expenditure (% of GDP),1.64462108853173,2019
Sudan,"Net bilateral aid flows from DAC donors, Belgium (current US$)",9999.99977648258,2019
Sudan,"Net trade in goods and services (BoP, current US$)",-4685625502.3079,2019
Sudan,"Population ages 25-29, female (% of female population)",7.74707692281842,2019
Sudan,"Population ages 45-49, female (% of female population)",3.95740900667767,2019
Sudan,Statistical performance indicators (SPI): Pillar 2 data services score (scale 0-100),57.9333333333333,2019
Sudan,"Communications, computer, etc. (% of service imports, BoP)",26.5343901465112,2019
Sudan,Depth of credit information index (0=low to 8=high),0.0,2019
Sudan,Final consumption expenditure (current US$),16779846899.7326,2019
Sudan,Forest area (sq. km),185317.1,2019
Sudan,"Merchandise imports by the reporting economy, residual (% of total merchandise imports)",3.47063656965767,2019
Sudan,Merchandise trade (% of GDP),49.8015749326238,2019
Sudan,"Net bilateral aid flows from DAC donors, European Union institutions (current US$)",55900001.5258789,2019
Sudan,Time required to start a business (days),34.5,2019
Sudan,"Time to export, documentary compliance (hours)",190.0,2019
Sudan,Total tax and contribution rate (% of profit),45.4,2019
Sudan,Households and NPISHs Final consumption expenditure (annual % growth),-0.899999733107848,2019
Sudan,"Net financial flows, others (NFL, current US$)",268492832.9,2019
Sudan,"Population ages 15-64, male",11950681.0,2019
Sudan,Population density (people per sq. km of land area),23.1518799666704,2019
Sudan,Access to electricity (% of population),53.8270721435547,2019
Sudan,Adjusted savings: energy depletion (current US$),145441444.884602,2019
Sudan,"Debt service on external debt, total (TDS, current US$)",195573725.0,2019
Sudan,Newborns protected against tetanus (%),80.0,2019
Sudan,"Agriculture, forestry, and fishing, value added (constant LCU)",6751026600.0,2019
Sudan,CPIA policy and institutions for environmental sustainability rating (1=low to 6=high),2.0,2019
Sudan,Import value index (2000 = 100),598.346622,2019
Sudan,Merchandise imports from low- and middle-income economies in Middle East & North Africa (% of total merchandise imports),8.75997095860276,2019
Sudan,Merchandise imports from low- and middle-income economies outside region (% of total merchandise imports),35.8034674391519,2019
Sudan,"Net bilateral aid flows from DAC donors, Netherlands (current US$)",9369999.88555908,2019
Sudan,Profit tax (% of commercial profits),11.5,2019
Sudan,"Wage and salaried workers, female (% of female employment) (modeled ILO estimate)",36.5200004577637,2019
Sudan,"Wage and salaried workers, total (% of total employment) (modeled ILO estimate)",45.6599998474121,2019
Sudan,"Age dependency ratio, young (% of working-age population)",71.4298600229754,2019
Sudan,DEC alternative conversion factor (LCU per US$),74.8,2019
Sudan,"GNI, PPP (constant 2017 international $)",167393777188.922,2019
Sudan,Imports of goods and services (annual % growth),-0.899996787495567,2019
Sudan,"Mortality from CVD, cancer, diabetes or CRD between exact ages 30 and 70, female (%)",21.4,2019
Sudan,"Mortality rate, under-5, female (per 1,000 live births)",53.1,2019
Sudan,"Net bilateral aid flows from DAC donors, Switzerland (current US$)",12420000.0762939,2019
Sudan,"Self-employed, total (% of total employment) (modeled ILO estimate)",54.3499984741211,2019
Sudan,Tax payments (number),42.0,2019
Sudan,Time required to build a warehouse (days),255.0,2019
Sudan,"Wage and salaried workers, male (% of male employment) (modeled ILO estimate)",48.8800010681152,2019
Sudan,"Commercial banks and other lending (PPG + PNG) (NFL, current US$)",0.0,2019
Sudan,"Net trade in goods (BoP, current US$)",-4626818440.46001,2019
Sudan,Travel services (% of commercial service exports),60.7596821413281,2019
Sudan,"Travel services (% of service exports, BoP)",60.1013631997051,2019
Sudan,Adjusted net national income per capita (annual % growth),1.00091829021972,2019
Sudan,"Employers, male (% of male employment) (modeled ILO estimate)",3.58999991416931,2019
Sudan,Gross capital formation (current LCU),700493381800.0,2019
Sudan,"Labor force participation rate, male (% of male population ages 15+) (modeled ILO estimate)",68.9919967651367,2019
Sudan,"Labor force participation rate, male (% of male population ages 15-64) (modeled ILO estimate)",69.15,2019
Sudan,Merchandise exports to high-income economies (% of total merchandise exports),76.0098904857388,2019
Sudan,Risk of impoverishing expenditure for surgical care (% of people at risk),46.1,2019
Sudan,Short-term debt (% of total external debt),24.3739,2019
Sudan,Transport services (% of commercial service exports),28.488985518743,2019
Sudan,Urban population growth (annual %),3.23652867012846,2019
Sudan,"Death rate, crude (per 1,000 people)",7.117,2019
Sudan,Individuals using the Internet (% of population),25.4,2019
Sudan,Population ages 0-14 (% of total population),40.155706045873,2019
Sudan,Rural population growth (annual %),1.94059190188622,2019
Sudan,"Start-up procedures to register a business, female (number)",10.0,2019
Sudan,"Birth rate, crude (per 1,000 people)",31.826,2019
Sudan,Export value index (2000 = 100),206.7115182,2019
Sudan,"Net bilateral aid flows from DAC donors, Luxembourg (current US$)",170000.001788139,2019
Sudan,"Population ages 10-14, female (% of female population)",12.0554544885549,2019
Sudan,"Access to electricity, urban (% of urban population)",81.3864440917969,2019
Sudan,"Cost to import, border compliance (US$)",1092.5,2019
Sudan,CPIA building human resources rating (1=low to 6=high),3.0,2019
Sudan,GDP deflator (base year varies by country),9394.98741404506,2019
Sudan,Number of infant deaths,55181.0,2019
Sudan,"Probability of dying among youth ages 20-24 years (per 1,000)",16.0,2019
Sudan,"Time required to start a business, male (days)",34.0,2019
Sudan,"Total debt service (% of exports of goods, services and primary income)",3.75873467947796,2019
Sudan,Broad money (% of GDP),35.2473229496873,2019
