country_name,indicator_name,year,value,service_level,residence,source
Sudan,CPIA debt policy rating (1=low to 6=high),2019.0,1.5,,,Word_bank_Sudan_sorted.csv
Sudan,Domestic general government health expenditure (% of current health expenditure),2019.0,22.6874733,,,Word_bank_Sudan_sorted.csv
Sudan,GNI per capita (current LCU),2019.0,42866.8660068847,,,Word_bank_Sudan_sorted.csv
Sudan,"Incidence of tuberculosis (per 100,000 people)",2019.0,67.0,,,Word_bank_Sudan_sorted.csv
Sudan,"Industry (including construction), value added (% of GDP)",2019.0,21.7363013265282,,,Word_bank_Sudan_sorted.csv
Sudan,"Industry (including construction), value added per worker (constant 2015 US$)",2019.0,8879.33590440149,,,Word_bank_Sudan_sorted.csv
Sudan,"Net bilateral aid flows from DAC donors, Slovak Republic (current US$)",2019.0,9999.99977648258,,,Word_bank_Sudan_sorted.csv
Sudan,Net ODA received (% of gross capital formation),2019.0,17.3485321124428,,,Word_bank_Sudan_sorted.csv
Sudan,"Net official flows from UN agencies, WHO (current US$)",2019.0,2995280.26580811,,,Word_bank_Sudan_sorted.csv
Sudan,Out-of-pocket expenditure per capita (current US$),2019.0,31.6222552,,,Word_bank_Sudan_sorted.csv
Sudan,"Population, female",2019.0,21425281.0,,,Word_bank_Sudan_sorted.csv
Sudan,Prevalence of undernourishment (% of population),2019.0,12.3,,,Word_bank_Sudan_sorted.csv
Sudan,Total debt service (% of GNI),2019.0,0.797099078561394,,,Word_bank_Sudan_sorted.csv
Sudan,"Agriculture, forestry, and fishing, value added (current US$)",2019.0,5274059390.37433,,,Word_bank_Sudan_sorted.csv
Sudan,Commercial service exports (current US$),2019.0,1351788909.30193,,,Word_bank_Sudan_sorted.csv
Sudan,"External debt stocks, public and publicly guaranteed (PPG) (DOD, current US$)",2019.0,16309393169.8,,,Word_bank_Sudan_sorted.csv
Sudan,Imports of goods and services (constant LCU),2019.0,1159892600.0,,,Word_bank_Sudan_sorted.csv
Sudan,Net barter terms of trade index (2000 = 100),2019.0,200.956828,,,Word_bank_Sudan_sorted.csv
Sudan,"Population ages 00-04, male (% of male population)",2019.0,14.8169418339929,,,Word_bank_Sudan_sorted.csv
Sudan,"Population ages 15-64, male (% of male population)",2019.0,55.8757508197604,,,Word_bank_Sudan_sorted.csv
Sudan,"Population ages 65 and above, female",2019.0,831202.0,,,Word_bank_Sudan_sorted.csv
Sudan,Prevalence of anemia among non-pregnant women (% of women ages 15-49),2019.0,36.5,,,Word_bank_Sudan_sorted.csv
Sudan,Gross savings (current LCU),2019.0,694274043015.047,,,Word_bank_Sudan_sorted.csv
Sudan,"Insurance and financial services (% of service imports, BoP)",2019.0,7.48350461436599,,,Word_bank_Sudan_sorted.csv
Sudan,"Net bilateral aid flows from DAC donors, Sweden (current US$)",2019.0,42459999.0844727,,,Word_bank_Sudan_sorted.csv
Sudan,Net domestic credit (current LCU),2019.0,454123960646.166,,,Word_bank_Sudan_sorted.csv
Sudan,Net primary income (Net income from abroad) (current US$),2019.0,-1620113578.87701,,,Word_bank_Sudan_sorted.csv
Sudan,"Population ages 50-54, male (% of male population)",2019.0,3.15599115689223,,,Word_bank_Sudan_sorted.csv
Sudan,"Service exports (BoP, current US$)",2019.0,1366595698.97677,,,Word_bank_Sudan_sorted.csv
Sudan,Adjusted net national income (annual % growth),2019.0,3.44540128282395,,,Word_bank_Sudan_sorted.csv
Sudan,Discrepancy in expenditure estimate of GDP (constant LCU),2019.0,344300.0,,,Word_bank_Sudan_sorted.csv
Sudan,Gross fixed capital formation (current US$),2019.0,9364884783.42246,,,Word_bank_Sudan_sorted.csv
Sudan,Gross national expenditure (constant LCU),2019.0,21810280400.0,,,Word_bank_Sudan_sorted.csv
Sudan,"Domestic general government health expenditure per capita, PPP (current international $)",2019.0,46.40389727,,,Word_bank_Sudan_sorted.csv
Sudan,External health expenditure (% of current health expenditure),2019.0,6.55756235,,,Word_bank_Sudan_sorted.csv
Sudan,"Insurance and financial services (% of service exports, BoP)",2019.0,0.248961874977038,,,Word_bank_Sudan_sorted.csv
Sudan,Merchandise exports to low- and middle-income economies in Latin America & the Caribbean (% of total merchandise exports),2019.0,0.0082916041451162,,,Word_bank_Sudan_sorted.csv
Sudan,"Time required to start a business, female (days)",2019.0,35.0,,,Word_bank_Sudan_sorted.csv
Sudan,CPIA fiscal policy rating (1=low to 6=high),2019.0,2.5,,,Word_bank_Sudan_sorted.csv
Sudan,"Employers, female (% of female employment) (modeled ILO estimate)",2019.0,1.62999999523163,,,Word_bank_Sudan_sorted.csv
Sudan,Final consumption expenditure (constant LCU),2019.0,21673082200.0,,,Word_bank_Sudan_sorted.csv
Sudan,"Net financial flows, bilateral (NFL, current US$)",2019.0,445131724.5,,,Word_bank_Sudan_sorted.csv
Sudan,"Population ages 10-14, male (% of male population)",2019.0,12.3955089490553,,,Word_bank_Sudan_sorted.csv
Sudan,Rural population,2019.0,27856005.0,,,Word_bank_Sudan_sorted.csv
Sudan,Adjusted savings: net national savings (% of GNI),2019.0,40.9195967069525,,,Word_bank_Sudan_sorted.csv
Sudan,Lower secondary school starting age (years),2019.0,12.0,,,Word_bank_Sudan_sorted.csv
Sudan,"Net bilateral aid flows from DAC donors, Slovenia (current US$)",2019.0,29999.9993294477,,,Word_bank_Sudan_sorted.csv
Sudan,"PPP conversion factor, GDP (LCU per international $)",2019.0,10.5049908178352,,,Word_bank_Sudan_sorted.csv
Sudan,Private credit bureau coverage (% of adults),2019.0,2.3,,,Word_bank_Sudan_sorted.csv
Sudan,Sex ratio at birth (male births per female births),2019.0,1.04,,,Word_bank_Sudan_sorted.csv
Sudan,Coal rents (% of GDP),2019.0,0.0,,,Word_bank_Sudan_sorted.csv
Sudan,Exports of goods and services (% of GDP),2019.0,0.630574147276582,,,Word_bank_Sudan_sorted.csv
Sudan,Gross domestic savings (% of GDP),2019.0,35.8465528377868,,,Word_bank_Sudan_sorted.csv
Sudan,Gross national expenditure (% of GDP),2019.0,99.9576857064326,,,Word_bank_Sudan_sorted.csv
Sudan,Households and NPISHs final consumption expenditure (% of GDP),2019.0,38.8786049883853,,,Word_bank_Sudan_sorted.csv
Sudan,"Mortality rate attributed to unintentional poisoning (per 100,000 population)",2019.0,1.7,,,Word_bank_Sudan_sorted.csv
Sudan,"Net financial flows, RDB concessional (NFL, current US$)",2019.0,0.0,,,Word_bank_Sudan_sorted.csv
Sudan,"Cost to export, border compliance (US$)",2019.0,966.5,,,Word_bank_Sudan_sorted.csv
Sudan,Domestic general government health expenditure per capita (current US$),2019.0,10.64696724,,,Word_bank_Sudan_sorted.csv
Sudan,Domestic private health expenditure per capita (current US$),2019.0,33.20448155,,,Word_bank_Sudan_sorted.csv
Sudan,"GNI per capita, PPP (current international $)",2019.0,4080.0,,,Word_bank_Sudan_sorted.csv
Sudan,Number of deaths ages 20-24 years,2019.0,13039.0,,,Word_bank_Sudan_sorted.csv
Sudan,"Prevalence of HIV, male (% ages 15-24)",2019.0,0.1,,,Word_bank_Sudan_sorted.csv
Sudan,"Primary education, duration (years)",2019.0,6.0,,,Word_bank_Sudan_sorted.csv
Sudan,Arms imports (SIPRI trend indicator values),2019.0,18000000.0,,,Word_bank_Sudan_sorted.csv
Sudan,"Contributing family workers, total (% of total employment) (modeled ILO estimate)",2019.0,8.01000022888184,,,Word_bank_Sudan_sorted.csv
Sudan,"Exports of goods, services and primary income (BoP, current US$)",2019.0,5203179837.82677,,,Word_bank_Sudan_sorted.csv
Sudan,GNI: linked series (current LCU),2019.0,1835269293800.0,,,Word_bank_Sudan_sorted.csv
Sudan,"IBRD loans and IDA credits (DOD, current US$)",2019.0,1201291000.0,,,Word_bank_Sudan_sorted.csv
Sudan,Merchandise imports from economies in the Arab World (% of total merchandise imports),2019.0,26.2065150381336,,,Word_bank_Sudan_sorted.csv
Sudan,"Mortality rate, infant, female (per 1,000 live births)",2019.0,36.1,,,Word_bank_Sudan_sorted.csv
Sudan,"Net bilateral aid flows from DAC donors, United States (current US$)",2019.0,275799987.792969,,,Word_bank_Sudan_sorted.csv
Sudan,"Trademark applications, total",2019.0,3425.0,,,Word_bank_Sudan_sorted.csv
Sudan,"Vulnerable employment, total (% of total employment) (modeled ILO estimate)",2019.0,51.269998550415,,,Word_bank_Sudan_sorted.csv
Sudan,"Agriculture, forestry, and fishing, value added (% of GDP)",2019.0,20.1640153484443,,,Word_bank_Sudan_sorted.csv
Sudan,Antiretroviral therapy coverage for PMTCT (% of pregnant women living with HIV),2019.0,4.0,,,Word_bank_Sudan_sorted.csv
Sudan,CPIA trade rating (1=low to 6=high),2019.0,2.5,,,Word_bank_Sudan_sorted.csv
Sudan,Gross fixed capital formation (% of GDP),2019.0,35.8042385442194,,,Word_bank_Sudan_sorted.csv
Sudan,Merchandise exports by the reporting economy (current US$),2019.0,6383662205.0,,,Word_bank_Sudan_sorted.csv
Sudan,Merchandise exports to low- and middle-income economies outside region (% of total merchandise exports),2019.0,22.5858744980382,,,Word_bank_Sudan_sorted.csv
Sudan,Net official development assistance received (constant 2018 US$),2019.0,1651199951.17188,,,Word_bank_Sudan_sorted.csv
Sudan,Secure Internet servers (per 1 million people),2019.0,4.29773623517418,,,Word_bank_Sudan_sorted.csv
Sudan,"Trademark applications, direct resident",2019.0,1647.0,,,Word_bank_Sudan_sorted.csv
Sudan,"Employment to population ratio, ages 15-24, female (%) (modeled ILO estimate)",2019.0,10.6619997024536,,,Word_bank_Sudan_sorted.csv
Sudan,"Employment to population ratio, ages 15-24, male (%) (modeled ILO estimate)",2019.0,25.2159996032715,,,Word_bank_Sudan_sorted.csv
Sudan,"Immunization, DPT (% of children ages 12-23 months)",2019.0,93.0,,,Word_bank_Sudan_sorted.csv
Sudan,"Survival to age 65, female (% of cohort)",2019.0,69.9544316,,,Word_bank_Sudan_sorted.csv
Sudan,Time required to get electricity (days),2019.0,70.0,,,Word_bank_Sudan_sorted.csv
Sudan,GNI (constant 2015 US$),2019.0,48011633457.7761,,,Word_bank_Sudan_sorted.csv
Sudan,GNI (current US$),2019.0,24535685745.9893,,,Word_bank_Sudan_sorted.csv
Sudan,Gross value added at basic prices (GVA) (current LCU),2019.0,1556084000000.0,,,Word_bank_Sudan_sorted.csv
Sudan,"Net official flows from UN agencies, WFP (current US$)",2019.0,251309.990882874,,,Word_bank_Sudan_sorted.csv
Sudan,Net secondary income (Net current transfers from abroad) (current US$),2019.0,1222635385.02674,,,Word_bank_Sudan_sorted.csv
Sudan,"Population ages 15-19, male (% of male population)",2019.0,11.097427916908,,,Word_bank_Sudan_sorted.csv
Sudan,"Adjusted net savings, excluding particulate emission damage (current US$)",2019.0,11391775731.5298,,,Word_bank_Sudan_sorted.csv
Sudan,Adjusted savings: particulate emission damage (% of GNI),2019.0,2.08726780069147,,,Word_bank_Sudan_sorted.csv
Sudan,Broad money growth (annual %),2019.0,60.0789296283337,,,Word_bank_Sudan_sorted.csv
Sudan,"Cost of business start-up procedures, male (% of GNI per capita)",2019.0,17.8,,,Word_bank_Sudan_sorted.csv
Sudan,Exports of goods and services (constant LCU),2019.0,173710800.0,,,Word_bank_Sudan_sorted.csv
Sudan,External health expenditure per capita (current US$),2019.0,3.07738781,,,Word_bank_Sudan_sorted.csv
Sudan,"Goods exports (BoP, current US$)",2019.0,3734656598.42139,,,Word_bank_Sudan_sorted.csv
Sudan,"Immunization, HepB3 (% of one-year-old children)",2019.0,93.0,,,Word_bank_Sudan_sorted.csv
Sudan,Investment in transport with private participation (current US$),2019.0,604370000.0,,,Word_bank_Sudan_sorted.csv
Sudan,Liner shipping connectivity index (maximum value in 2004 = 100),2019.0,8.9116560094,,,Word_bank_Sudan_sorted.csv
Sudan,"Net primary income (BoP, current US$)",2019.0,-1620113578.74618,,,Word_bank_Sudan_sorted.csv
Sudan,"Portfolio equity, net inflows (BoP, current US$)",2019.0,0.0,,,Word_bank_Sudan_sorted.csv
Sudan,"Services, value added per worker (constant 2015 US$)",2019.0,5535.78614391369,,,Word_bank_Sudan_sorted.csv
Sudan,Net foreign assets (current LCU),2019.0,-220616544397.929,,,Word_bank_Sudan_sorted.csv
Sudan,"Net official flows from UN agencies, UNICEF (current US$)",2019.0,100535003.662109,,,Word_bank_Sudan_sorted.csv
Sudan,"Patent applications, residents",2019.0,238.0,,,Word_bank_Sudan_sorted.csv
Sudan,"Personal remittances, received (current US$)",2019.0,522317287.755546,,,Word_bank_Sudan_sorted.csv
Sudan,"Trademark applications, resident, by count",2019.0,1647.0,,,Word_bank_Sudan_sorted.csv
Sudan,Young people (ages 15-24) newly infected with HIV,2019.0,1000.0,,,Word_bank_Sudan_sorted.csv
Sudan,External balance on goods and services (constant LCU),2019.0,-986181800.0,,,Word_bank_Sudan_sorted.csv
Sudan,GDP (constant LCU),2019.0,20824442900.0,,,Word_bank_Sudan_sorted.csv
Sudan,GDP per capita (current US$),2019.0,610.927861513165,,,Word_bank_Sudan_sorted.csv
Sudan,GDP per capita growth (annual %),2019.0,-4.48984342796072,,,Word_bank_Sudan_sorted.csv
Sudan,Gross domestic savings (current US$),2019.0,9375952425.13369,,,Word_bank_Sudan_sorted.csv
Sudan,Gross fixed capital formation (annual % growth),2019.0,-0.199966393425328,,,Word_bank_Sudan_sorted.csv
Sudan,"Immunization, measles (% of children ages 12-23 months)",2019.0,90.0,,,Word_bank_Sudan_sorted.csv
Sudan,Imports of goods and services (current LCU),2019.0,11509253400.0,,,Word_bank_Sudan_sorted.csv
Sudan,"Life expectancy at birth, male (years)",2019.0,63.467,,,Word_bank_Sudan_sorted.csv
Sudan,"Population ages 0-14, total",2019.0,17191958.0,,,Word_bank_Sudan_sorted.csv
Sudan,"Population ages 20-24, female (% of female population)",2019.0,9.32817637257593,,,Word_bank_Sudan_sorted.csv
Sudan,"PPG, official creditors (NFL, current US$)",2019.0,713624557.4,,,Word_bank_Sudan_sorted.csv
Sudan,"PPG, other private creditors (NFL, current US$)",2019.0,0.0,,,Word_bank_Sudan_sorted.csv
Sudan,"Transport services (% of service imports, BoP)",2019.0,65.1832305158857,,,Word_bank_Sudan_sorted.csv
Sudan,Adjusted net national income (constant 2015 US$),2019.0,47361954122.0402,,,Word_bank_Sudan_sorted.csv
Sudan,CPIA macroeconomic management rating (1=low to 6=high),2019.0,1.5,,,Word_bank_Sudan_sorted.csv
Sudan,"Imports of goods, services and primary income (BoP, current US$)",2019.0,11508918918.8809,,,Word_bank_Sudan_sorted.csv
Sudan,Merchandise imports from low- and middle-income economies in Latin America & the Caribbean (% of total merchandise imports),2019.0,0.439518730046195,,,Word_bank_Sudan_sorted.csv
Sudan,"Net errors and omissions (BoP, current US$)",2019.0,647619128.606367,,,Word_bank_Sudan_sorted.csv
Sudan,GDP deflator: linked series (base year varies by country),2019.0,9394.98741404506,,,Word_bank_Sudan_sorted.csv
Sudan,Merchandise exports to low- and middle-income economies in South Asia (% of total merchandise exports),2019.0,6.49336938090696,,,Word_bank_Sudan_sorted.csv
Sudan,"Multilateral debt service (TDS, current US$)",2019.0,55790178.1,,,Word_bank_Sudan_sorted.csv
Sudan,"Official exchange rate (LCU per US$, period average)",2019.0,45.7670454545455,,,Word_bank_Sudan_sorted.csv
Sudan,Prevalence of moderate or severe food insecurity in the population (%),2019.0,49.4,,,Word_bank_Sudan_sorted.csv
Sudan,Rural population (% of total population),2019.0,65.064,,,Word_bank_Sudan_sorted.csv
Sudan,Taxes less subsidies on products (current US$),2019.0,5352537292.78075,,,Word_bank_Sudan_sorted.csv
Sudan,Time to prepare and pay taxes (hours),2019.0,180.0,,,Word_bank_Sudan_sorted.csv
Sudan,Adjusted savings: consumption of fixed capital (% of GNI),2019.0,17.2075686112074,,,Word_bank_Sudan_sorted.csv
Sudan,Claims on private sector (annual growth as % of broad money),2019.0,13.0854740004239,,,Word_bank_Sudan_sorted.csv
Sudan,Current account balance (% of GDP),2019.0,-18.2744917292001,,,Word_bank_Sudan_sorted.csv
Sudan,Final consumption expenditure (constant 2015 US$),2019.0,33189881392.6237,,,Word_bank_Sudan_sorted.csv
Sudan,"Population ages 15-64, female",2019.0,12117629.0,,,Word_bank_Sudan_sorted.csv
Sudan,Taxes less subsidies on products (constant LCU),2019.0,252068500.0,,,Word_bank_Sudan_sorted.csv
Sudan,"Agriculture, forestry, and fishing, value added (current LCU)",2019.0,394499642400.0,,,Word_bank_Sudan_sorted.csv
Sudan,Final consumption expenditure (annual % growth),2019.0,-2.19043449725282,,,Word_bank_Sudan_sorted.csv
Sudan,"Net bilateral aid flows from DAC donors, Ireland (current US$)",2019.0,5989999.77111816,,,Word_bank_Sudan_sorted.csv
Sudan,"Net official flows from UN agencies, UNHCR (current US$)",2019.0,1406230.80730438,,,Word_bank_Sudan_sorted.csv
Sudan,"Trademark applications, nonresident, by count",2019.0,3596.0,,,Word_bank_Sudan_sorted.csv
Sudan,"Adjusted net savings, including particulate emission damage (current US$)",2019.0,10788708555.945,,,Word_bank_Sudan_sorted.csv
Sudan,Adjusted savings: consumption of fixed capital (current US$),2019.0,4971724182.97444,,,Word_bank_Sudan_sorted.csv
Sudan,Adjusted savings: carbon dioxide damage (current US$),2019.0,794739993.703243,,,Word_bank_Sudan_sorted.csv
Sudan,"Employment to population ratio, 15+, male (%) (modeled ILO estimate)",2019.0,60.0909996032715,,,Word_bank_Sudan_sorted.csv
Sudan,"Incidence of HIV, all (per 1,000 uninfected population)",2019.0,0.09,,,Word_bank_Sudan_sorted.csv
Sudan,"Mortality rate, adult, male (per 1,000 male adults)",2019.0,242.683,,,Word_bank_Sudan_sorted.csv
Sudan,Procedures to register property (number),2019.0,6.0,,,Word_bank_Sudan_sorted.csv
Sudan,"Suicide mortality rate (per 100,000 population)",2019.0,3.8,,,Word_bank_Sudan_sorted.csv
Sudan,"Agriculture, forestry, and fishing, value added per worker (constant 2015 US$)",2019.0,3885.40970456462,,,Word_bank_Sudan_sorted.csv
Sudan,"Cause of death, by communicable diseases and maternal, prenatal and nutrition conditions (% of total)",2019.0,35.5456510407433,,,Word_bank_Sudan_sorted.csv
Sudan,Container port traffic (TEU: 20 foot equivalent units),2019.0,469526.0,,,Word_bank_Sudan_sorted.csv
Sudan,Fixed broadband subscriptions (per 100 people),2019.0,0.07652306,,,Word_bank_Sudan_sorted.csv
Sudan,GDP: linked series (current LCU),2019.0,1956453789500.0,,,Word_bank_Sudan_sorted.csv
Sudan,Gross domestic income (constant LCU),2019.0,21894033381.8903,,,Word_bank_Sudan_sorted.csv
Sudan,"Net bilateral aid flows from DAC donors, Australia (current US$)",2019.0,3170000.07629395,,,Word_bank_Sudan_sorted.csv
Sudan,"Portfolio investment, net (BoP, current US$)",2019.0,36367118.0476741,,,Word_bank_Sudan_sorted.csv
Sudan,"Prevalence of overweight (modeled estimate, % of children under 5)",2019.0,2.6,,,Word_bank_Sudan_sorted.csv
Sudan,Adjusted savings: net forest depletion (% of GNI),2019.0,0.415176961348047,,,Word_bank_Sudan_sorted.csv
Sudan,"Net bilateral aid flows from DAC donors, Spain (current US$)",2019.0,1000000.0,,,Word_bank_Sudan_sorted.csv
Sudan,"Net official flows from UN agencies, FAO (current US$)",2019.0,610756.158828735,,,Word_bank_Sudan_sorted.csv
Sudan,People using at least basic drinking water services (% of population),2019.0,60.38348683,,,Word_bank_Sudan_sorted.csv
Sudan,"Unemployment, youth total (% of total labor force ages 15-24) (modeled ILO estimate)",2019.0,32.7820014953613,,,Word_bank_Sudan_sorted.csv
Sudan,Aquaculture production (metric tons),2018.0,10000.0,,,Word_bank_Sudan_sorted.csv
Sudan,"Multilateral debt service (TDS, current US$)",2018.0,25500782.0,,,Word_bank_Sudan_sorted.csv
Sudan,Short-term debt (% of total external debt),2018.0,25.121,,,Word_bank_Sudan_sorted.csv
Sudan,"Children out of school, male (% of male primary school age)",2018.0,30.52712059021,,,Word_bank_Sudan_sorted.csv
Sudan,Fixed telephone subscriptions (per 100 people),2018.0,0.327554973,,,Word_bank_Sudan_sorted.csv
Sudan,Gross capital formation (constant 2015 US$),2018.0,9190126403.18491,,,Word_bank_Sudan_sorted.csv
Sudan,"Net official flows from UN agencies, FAO (current US$)",2018.0,90934.5969557762,,,Word_bank_Sudan_sorted.csv
Sudan,"School enrollment, primary (gross), gender parity index (GPI)",2018.0,0.93164998292923,,,Word_bank_Sudan_sorted.csv
Sudan,"Survival to age 65, female (% of cohort)",2018.0,69.5758718,,,Word_bank_Sudan_sorted.csv
Sudan,Terms of trade adjustment (constant LCU),2018.0,883476740.534687,,,Word_bank_Sudan_sorted.csv
Sudan,Adults (ages 15-49) newly infected with HIV,2018.0,2900.0,,,Word_bank_Sudan_sorted.csv
Sudan,Arable land (hectares per person),2018.0,0.474220896975738,,,Word_bank_Sudan_sorted.csv
Sudan,Claims on other sectors of the domestic economy (annual growth as % of broad money),2018.0,34.2497665574044,,,Word_bank_Sudan_sorted.csv
Sudan,Final consumption expenditure (constant LCU),2018.0,22158448500.0,,,Word_bank_Sudan_sorted.csv
Sudan,"Probability of dying among adolescents ages 15-19 years (per 1,000)",2018.0,11.0,,,Word_bank_Sudan_sorted.csv
Sudan,"Time to import, documentary compliance (hours)",2018.0,132.0,,,Word_bank_Sudan_sorted.csv
Sudan,"Transport services (% of service exports, BoP)",2018.0,27.0939703744133,,,Word_bank_Sudan_sorted.csv
Sudan,Adjusted savings: mineral depletion (% of GNI),2018.0,0.000141116424272,,,Word_bank_Sudan_sorted.csv
Sudan,Agricultural nitrous oxide emissions (thousand metric tons of CO2 equivalent),2018.0,28150.0,,,Word_bank_Sudan_sorted.csv
Sudan,Arms imports (SIPRI trend indicator values),2018.0,34000000.0,,,Word_bank_Sudan_sorted.csv
Sudan,Gross savings (current US$),2018.0,9907615246.66278,,,Word_bank_Sudan_sorted.csv
Sudan,Households and NPISHs Final consumption expenditure (constant LCU),2018.0,19296183500.0,,,Word_bank_Sudan_sorted.csv
Sudan,"International tourism, receipts (current US$)",2018.0,1043000000.0,,,Word_bank_Sudan_sorted.csv
Sudan,Land area (sq. km),2018.0,1849233.715,,,Word_bank_Sudan_sorted.csv
Sudan,Merchandise imports from low- and middle-income economies within region (% of total merchandise imports),2018.0,3.76342040021919,,,Word_bank_Sudan_sorted.csv
Sudan,"Mortality rate, under-5, male (per 1,000 live births)",2018.0,65.1,,,Word_bank_Sudan_sorted.csv
Sudan,Net primary income (Net income from abroad) (current US$),2018.0,-1812341931.76471,,,Word_bank_Sudan_sorted.csv
Sudan,Population in urban agglomerations of more than 1 million (% of total population),2018.0,13.2389382283884,,,Word_bank_Sudan_sorted.csv
Sudan,Public credit registry coverage (% of adults),2018.0,0.0,,,Word_bank_Sudan_sorted.csv
Sudan,Surface area (sq. km),2018.0,1854105.405,,,Word_bank_Sudan_sorted.csv
Sudan,"Unemployment, female (% of female labor force) (modeled ILO estimate)",2018.0,28.632999420166,,,Word_bank_Sudan_sorted.csv
Sudan,Adjusted savings: natural resources depletion (% of GNI),2018.0,0.879190267556858,,,Word_bank_Sudan_sorted.csv
Sudan,Gross capital formation (% of GDP),2018.0,36.7100639298114,,,Word_bank_Sudan_sorted.csv
Sudan,Gross national expenditure (constant LCU),2018.0,22295921600.0,,,Word_bank_Sudan_sorted.csv
Sudan,Imports of goods and services (annual % growth),2018.0,2.40000279966353,,,Word_bank_Sudan_sorted.csv
Sudan,"Industry (including construction), value added (current LCU)",2018.0,273405881500.0,,,Word_bank_Sudan_sorted.csv
Sudan,Population ages 15-64 (% of total population),2018.0,55.9100476051919,,,Word_bank_Sudan_sorted.csv
Sudan,"Population ages 15-64, female",2018.0,11771161.0,,,Word_bank_Sudan_sorted.csv
Sudan,"Transport services (% of service imports, BoP)",2018.0,66.9922789717714,,,Word_bank_Sudan_sorted.csv
Sudan,Fixed broadband subscriptions (per 100 people),2018.0,0.075002034,,,Word_bank_Sudan_sorted.csv
Sudan,"Population ages 60-64, female (% of female population)",2018.0,2.03012955755637,,,Word_bank_Sudan_sorted.csv
Sudan,Commercial service imports (current US$),2018.0,1062981731.22239,,,Word_bank_Sudan_sorted.csv
Sudan,Container port traffic (TEU: 20 foot equivalent units),2018.0,451712.0,,,Word_bank_Sudan_sorted.csv
Sudan,Labor tax and contributions (% of commercial profits),2018.0,19.2,,,Word_bank_Sudan_sorted.csv
Sudan,"Population, total",2018.0,41801532.0,,,Word_bank_Sudan_sorted.csv
Sudan,"Suicide mortality rate, male (per 100,000 male population)",2018.0,4.9,,,Word_bank_Sudan_sorted.csv
Sudan,CO2 emissions (kg per PPP $ of GDP),2018.0,0.107993421994353,,,Word_bank_Sudan_sorted.csv
Sudan,"Cost of business start-up procedures, male (% of GNI per capita)",2018.0,20.9,,,Word_bank_Sudan_sorted.csv
Sudan,GDP per capita (current US$),2018.0,740.746767001408,,,Word_bank_Sudan_sorted.csv
Sudan,Import volume index (2000 = 100),2018.0,350.5166461,,,Word_bank_Sudan_sorted.csv
Sudan,"Labor force participation rate for ages 15-24, female (%) (modeled ILO estimate)",2018.0,18.6469993591309,,,Word_bank_Sudan_sorted.csv
Sudan,"Net bilateral aid flows from DAC donors, Portugal (current US$)",2018.0,230000.004172325,,,Word_bank_Sudan_sorted.csv
Sudan,"Net primary income (BoP, current US$)",2018.0,-1812341931.82223,,,Word_bank_Sudan_sorted.csv
Sudan,"Population ages 05-09, female (% of female population)",2018.0,13.2742505396359,,,Word_bank_Sudan_sorted.csv
Sudan,Population in the largest city (% of urban population),2018.0,38.2164366036418,,,Word_bank_Sudan_sorted.csv
Sudan,"Wage and salaried workers, female (% of female employment) (modeled ILO estimate)",2018.0,35.9599990844727,,,Word_bank_Sudan_sorted.csv
Sudan,"Computer, communications and other services (% of commercial service exports)",2018.0,2.03756120784317,,,Word_bank_Sudan_sorted.csv
Sudan,Domestic credit to private sector by banks (% of GDP),2018.0,9.35475603325025,,,Word_bank_Sudan_sorted.csv
Sudan,"Employment to population ratio, ages 15-24, total (%) (modeled ILO estimate)",2018.0,18.4290008544922,,,Word_bank_Sudan_sorted.csv
Sudan,Exports of goods and services (constant LCU),2018.0,162498400.0,,,Word_bank_Sudan_sorted.csv
Sudan,GNI: linked series (current LCU),2018.0,1238960329500.0,,,Word_bank_Sudan_sorted.csv
Sudan,"Labor force participation rate, female (% of female population ages 15-64) (modeled ILO estimate)",2018.0,30.34,,,Word_bank_Sudan_sorted.csv
Sudan,Merchandise imports from low- and middle-income economies in South Asia (% of total merchandise imports),2018.0,11.5818977576235,,,Word_bank_Sudan_sorted.csv
Sudan,Methodology assessment of statistical capacity (scale 0 - 100),2018.0,50.0,,,Word_bank_Sudan_sorted.csv
Sudan,Number of neonatal deaths,2018.0,37478.0,,,Word_bank_Sudan_sorted.csv
