country_name,indicator_name,year,value,service_level,residence,source
Sudan,Domestic general government health expenditure per capita (current US$),2019.0,10.64696724,,,world_bank_SQL.csv
Sudan,Domestic private health expenditure per capita (current US$),2019.0,33.20448155,,,world_bank_SQL.csv
Sudan,"GNI per capita, PPP (current international $)",2019.0,4080.0,,,world_bank_SQL.csv
Sudan,Number of deaths ages 20-24 years,2019.0,13039.0,,,world_bank_SQL.csv
Sudan,"Prevalence of HIV, male (% ages 15-24)",2019.0,0.1,,,world_bank_SQL.csv
Sudan,Arms imports (SIPRI trend indicator values),2019.0,18000000.0,,,world_bank_SQL.csv
Sudan,"Contributing family workers, total (% of total employment) (modeled ILO estimate)",2019.0,8.010000229,,,world_bank_SQL.csv
Sudan,"Exports of goods, services and primary income (BoP, current US$)",2019.0,5203179838.0,,,world_bank_SQL.csv
Sudan,GNI: linked series (current LCU),2019.0,1835269293800.0,,,world_bank_SQL.csv
Sudan,"IBRD loans and IDA credits (DOD, current US$)",2019.0,1201291000.0,,,world_bank_SQL.csv
Sudan,Merchandise imports from economies in the Arab World (% of total merchandise imports),2019.0,26.20651504,,,world_bank_SQL.csv
Sudan,"Mortality rate, infant, female (per 1,000 live births)",2019.0,36.1,,,world_bank_SQL.csv
Sudan,"Net bilateral aid flows from DAC donors, United States (current US$)",2019.0,275799987.8,,,world_bank_SQL.csv
Sudan,"Trademark applications, total",2019.0,3425.0,,,world_bank_SQL.csv
Sudan,"Vulnerable employment, total (% of total employment) (modeled ILO estimate)",2019.0,51.26999855,,,world_bank_SQL.csv
Sudan,"Agriculture, forestry, and fishing, value added (% of GDP)",2019.0,20.16401535,,,world_bank_SQL.csv
Sudan,Antiretroviral therapy coverage for PMTCT (% of pregnant women living with HIV),2019.0,4.0,,,world_bank_SQL.csv
Sudan,Gross fixed capital formation (% of GDP),2019.0,35.80423854,,,world_bank_SQL.csv
Sudan,Merchandise exports by the reporting economy (current US$),2019.0,6383662205.0,,,world_bank_SQL.csv
Sudan,Merchandise exports to low- and middle-income economies outside region (% of total merchandise exports),2019.0,22.5858745,,,world_bank_SQL.csv
Sudan,Net official development assistance received (constant 2018 US$),2019.0,1651199951.0,,,world_bank_SQL.csv
Sudan,Secure Internet servers (per 1 million people),2019.0,4.297736235,,,world_bank_SQL.csv
Sudan,"Trademark applications, direct resident",2019.0,1647.0,,,world_bank_SQL.csv
Sudan,"Employment to population ratio, ages 15-24, female (%) (modeled ILO estimate)",2019.0,10.6619997,,,world_bank_SQL.csv
Sudan,"Employment to population ratio, ages 15-24, male (%) (modeled ILO estimate)",2019.0,25.2159996,,,world_bank_SQL.csv
Sudan,"Immunization, DPT (% of children ages 12-23 months)",2019.0,93.0,,,world_bank_SQL.csv
Sudan,"Survival to age 65, female (% of cohort)",2019.0,69.9544316,,,world_bank_SQL.csv
Sudan,Time required to get electricity (days),2019.0,70.0,,,world_bank_SQL.csv
Sudan,GNI (constant 2015 US$),2019.0,48011633458.0,,,world_bank_SQL.csv
Sudan,GNI (current US$),2019.0,24535685746.0,,,world_bank_SQL.csv
Sudan,Gross value added at basic prices (GVA) (current LCU),2019.0,1556084000000.0,,,world_bank_SQL.csv
Sudan,"Net official flows from UN agencies, WFP (current US$)",2019.0,251309.9909,,,world_bank_SQL.csv
Sudan,Net secondary income (Net current transfers from abroad) (current US$),2019.0,1222635385.0,,,world_bank_SQL.csv
Sudan,"Population ages 15-19, male (% of male population)",2019.0,11.09742792,,,world_bank_SQL.csv
Sudan,"Adjusted net savings, excluding particulate emission damage (current US$)",2019.0,11391775732.0,,,world_bank_SQL.csv
Sudan,Adjusted savings: particulate emission damage (% of GNI),2019.0,2.087267801,,,world_bank_SQL.csv
Sudan,Broad money growth (annual %),2019.0,60.07892963,,,world_bank_SQL.csv
Sudan,"Cost of business start-up procedures, male (% of GNI per capita)",2019.0,17.8,,,world_bank_SQL.csv
Sudan,Exports of goods and services (constant LCU),2019.0,173710800.0,,,world_bank_SQL.csv
Sudan,External health expenditure per capita (current US$),2019.0,3.07738781,,,world_bank_SQL.csv
Sudan,"Goods exports (BoP, current US$)",2019.0,3734656598.0,,,world_bank_SQL.csv
Sudan,"Immunization, HepB3 (% of one-year-old children)",2019.0,93.0,,,world_bank_SQL.csv
Sudan,Investment in transport with private participation (current US$),2019.0,604370000.0,,,world_bank_SQL.csv
Sudan,Liner shipping connectivity index (maximum value in 2004 = 100),2019.0,8.911656009,,,world_bank_SQL.csv
Sudan,"Net primary income (BoP, current US$)",2019.0,-1620113579.0,,,world_bank_SQL.csv
Sudan,"Services, value added per worker (constant 2015 US$)",2019.0,5535.786144,,,world_bank_SQL.csv
Sudan,Net foreign assets (current LCU),2019.0,-220616544398.0,,,world_bank_SQL.csv
Sudan,"Net official flows from UN agencies, UNICEF (current US$)",2019.0,100535003.7,,,world_bank_SQL.csv
Sudan,"Patent applications, residents",2019.0,238.0,,,world_bank_SQL.csv
Sudan,"Personal remittances, received (current US$)",2019.0,522317287.8,,,world_bank_SQL.csv
Sudan,"Trademark applications, resident, by count",2019.0,1647.0,,,world_bank_SQL.csv
Sudan,Young people (ages 15-24) newly infected with HIV,2019.0,1000.0,,,world_bank_SQL.csv
Sudan,External balance on goods and services (constant LCU),2019.0,-986181800.0,,,world_bank_SQL.csv
Sudan,GDP (constant LCU),2019.0,20824442900.0,,,world_bank_SQL.csv
Sudan,GDP per capita (current US$),2019.0,610.9278615,,,world_bank_SQL.csv
Sudan,GDP per capita growth (annual %),2019.0,-4.489843428,,,world_bank_SQL.csv
Sudan,Gross domestic savings (current US$),2019.0,9375952425.0,,,world_bank_SQL.csv
Sudan,Gross fixed capital formation (annual % growth),2019.0,-0.1999663934,,,world_bank_SQL.csv
Sudan,"Immunization, measles (% of children ages 12-23 months)",2019.0,90.0,,,world_bank_SQL.csv
Sudan,Imports of goods and services (current LCU),2019.0,11509253400.0,,,world_bank_SQL.csv
Sudan,"Life expectancy at birth, male (years)",2019.0,63.467,,,world_bank_SQL.csv
Sudan,"Population ages 0-14, total",2019.0,17191958.0,,,world_bank_SQL.csv
Sudan,"Population ages 20-24, female (% of female population)",2019.0,9.328176373,,,world_bank_SQL.csv
Sudan,"PPG, official creditors (NFL, current US$)",2019.0,713624557.4,,,world_bank_SQL.csv
Sudan,"Transport services (% of service imports, BoP)",2019.0,65.18323052,,,world_bank_SQL.csv
Sudan,Adjusted net national income (constant 2015 US$),2019.0,47361954122.0,,,world_bank_SQL.csv
Sudan,CPIA macroeconomic management rating (1=low to 6=high),2019.0,1.5,,,world_bank_SQL.csv
Sudan,"Imports of goods, services and primary income (BoP, current US$)",2019.0,11508918919.0,,,world_bank_SQL.csv
Sudan,Merchandise imports from low- and middle-income economies in Latin America & the Caribbean (% of total merchandise imports),2019.0,0.43951873,,,world_bank_SQL.csv
Sudan,"Net errors and omissions (BoP, current US$)",2019.0,647619128.6,,,world_bank_SQL.csv
Sudan,GDP deflator: linked series (base year varies by country),2019.0,9394.987414,,,world_bank_SQL.csv
Sudan,Merchandise exports to low- and middle-income economies in South Asia (% of total merchandise exports),2019.0,6.493369381,,,world_bank_SQL.csv
Sudan,"Multilateral debt service (TDS, current US$)",2019.0,55790178.1,,,world_bank_SQL.csv
Sudan,"Official exchange rate (LCU per US$, period average)",2019.0,45.76704545,,,world_bank_SQL.csv
Sudan,Prevalence of moderate or severe food insecurity in the population (%),2019.0,49.4,,,world_bank_SQL.csv
Sudan,Rural population (% of total population),2019.0,65.064,,,world_bank_SQL.csv
Sudan,Taxes less subsidies on products (current US$),2019.0,5352537293.0,,,world_bank_SQL.csv
Sudan,Time to prepare and pay taxes (hours),2019.0,180.0,,,world_bank_SQL.csv
Sudan,Adjusted savings: consumption of fixed capital (% of GNI),2019.0,17.20756861,,,world_bank_SQL.csv
Sudan,Claims on private sector (annual growth as % of broad money),2019.0,13.085474,,,world_bank_SQL.csv
Sudan,Current account balance (% of GDP),2019.0,-18.27449173,,,world_bank_SQL.csv
Sudan,Final consumption expenditure (constant 2015 US$),2019.0,33189881393.0,,,world_bank_SQL.csv
Sudan,"Population ages 15-64, female",2019.0,12117629.0,,,world_bank_SQL.csv
Sudan,Taxes less subsidies on products (constant LCU),2019.0,252068500.0,,,world_bank_SQL.csv
Sudan,"Agriculture, forestry, and fishing, value added (current LCU)",2019.0,394499642400.0,,,world_bank_SQL.csv
Sudan,Final consumption expenditure (annual % growth),2019.0,-2.190434497,,,world_bank_SQL.csv
Sudan,"Net bilateral aid flows from DAC donors, Ireland (current US$)",2019.0,5989999.771,,,world_bank_SQL.csv
Sudan,"Net official flows from UN agencies, UNHCR (current US$)",2019.0,1406230.807,,,world_bank_SQL.csv
Sudan,"Trademark applications, nonresident, by count",2019.0,3596.0,,,world_bank_SQL.csv
Sudan,"Adjusted net savings, including particulate emission damage (current US$)",2019.0,10788708556.0,,,world_bank_SQL.csv
Sudan,Adjusted savings: consumption of fixed capital (current US$),2019.0,4971724183.0,,,world_bank_SQL.csv
Sudan,Adjusted savings: carbon dioxide damage (current US$),2019.0,794739993.7,,,world_bank_SQL.csv
Sudan,"Employment to population ratio, 15+, male (%) (modeled ILO estimate)",2019.0,60.0909996,,,world_bank_SQL.csv
Sudan,"Incidence of HIV, all (per 1,000 uninfected population)",2019.0,0.09,,,world_bank_SQL.csv
Sudan,"Mortality rate, adult, male (per 1,000 male adults)",2019.0,242.683,,,world_bank_SQL.csv
Sudan,"Suicide mortality rate (per 100,000 population)",2019.0,3.8,,,world_bank_SQL.csv
Sudan,"Agriculture, forestry, and fishing, value added per worker (constant 2015 US$)",2019.0,3885.409705,,,world_bank_SQL.csv
Sudan,"Cause of death, by communicable diseases and maternal, prenatal and nutrition conditions (% of total)",2019.0,35.54565104,,,world_bank_SQL.csv
Sudan,Container port traffic (TEU: 20 foot equivalent units),2019.0,469526.0,,,world_bank_SQL.csv
Sudan,Fixed broadband subscriptions (per 100 people),2019.0,0.07652306,,,world_bank_SQL.csv
Sudan,GDP: linked series (current LCU),2019.0,1956453789500.0,,,world_bank_SQL.csv
Sudan,Gross domestic income (constant LCU),2019.0,21894033382.0,,,world_bank_SQL.csv
Sudan,"Net bilateral aid flows from DAC donors, Australia (current US$)",2019.0,3170000.076,,,world_bank_SQL.csv
Sudan,"Portfolio investment, net (BoP, current US$)",2019.0,36367118.05,,,world_bank_SQL.csv
Sudan,"Prevalence of overweight (modeled estimate, % of children under 5)",2019.0,2.6,,,world_bank_SQL.csv
Sudan,Adjusted savings: net forest depletion (% of GNI),2019.0,0.4151769613,,,world_bank_SQL.csv
Sudan,"Net bilateral aid flows from DAC donors, Spain (current US$)",2019.0,1000000.0,,,world_bank_SQL.csv
Sudan,"Net official flows from UN agencies, FAO (current US$)",2019.0,610756.1588,,,world_bank_SQL.csv
Sudan,People using at least basic drinking water services (% of population),2019.0,60.38348683,,,world_bank_SQL.csv
Sudan,"Unemployment, youth total (% of total labor force ages 15-24) (modeled ILO estimate)",2019.0,32.7820015,,,world_bank_SQL.csv
Sudan,"Foreign direct investment, net outflows (% of GDP)",2019.0,0.0,,,world_bank_SQL.csv
Sudan,Natural gas rents (% of GDP),2019.0,0.0,,,world_bank_SQL.csv
Sudan,"Net bilateral aid flows from DAC donors, Greece (current US$)",2019.0,0.0,,,world_bank_SQL.csv
Sudan,Public credit registry coverage (% of adults),2019.0,0.0,,,world_bank_SQL.csv
Sudan,"PPG, private creditors (NFL, current US$)",2019.0,0.0,,,world_bank_SQL.csv
Sudan,"IFC, private nonguaranteed (NFL, current US$)",2019.0,0.0,,,world_bank_SQL.csv
Sudan,"Foreign direct investment, net outflows (BoP, current US$)",2019.0,0.0,,,world_bank_SQL.csv
Sudan,"PPG, commercial banks (NFL, current US$)",2019.0,0.0,,,world_bank_SQL.csv
Sudan,Depth of credit information index (0=low to 8=high),2019.0,0.0,,,world_bank_SQL.csv
Sudan,"Commercial banks and other lending (PPG + PNG) (NFL, current US$)",2019.0,0.0,,,world_bank_SQL.csv
Sudan,"Net financial flows, RDB nonconcessional (NFL, current US$)",2019.0,0.0,,,world_bank_SQL.csv
Sudan,Coal rents (% of GDP),2019.0,0.0,,,world_bank_SQL.csv
Sudan,"Net financial flows, RDB concessional (NFL, current US$)",2019.0,0.0,,,world_bank_SQL.csv
Sudan,"Portfolio equity, net inflows (BoP, current US$)",2019.0,0.0,,,world_bank_SQL.csv
Sudan,"PPG, other private creditors (NFL, current US$)",2019.0,0.0,,,world_bank_SQL.csv
Sudan,CPIA quality of public administration rating (1=low to 6=high),2019.0,2.0,,,world_bank_SQL.csv
Sudan,"Preprimary education, duration (years)",2019.0,2.0,,,world_bank_SQL.csv
Sudan,Time to resolve insolvency (years),2019.0,2.0,,,world_bank_SQL.csv
Sudan,"Mortality rate attributed to unintentional poisoning, male (per 100,000 male population)",2019.0,2.0,,,world_bank_SQL.csv
Sudan,CPIA property rights and rule-based governance rating (1=low to 6=high),2019.0,2.0,,,world_bank_SQL.csv
Sudan,CPIA policy and institutions for environmental sustainability rating (1=low to 6=high),2019.0,2.0,,,world_bank_SQL.csv
Sudan,CPIA efficiency of revenue mobilization rating (1=low to 6=high),2019.0,2.5,,,world_bank_SQL.csv
Sudan,CPIA policies for social inclusion/equity cluster average (1=low to 6=high),2019.0,2.5,,,world_bank_SQL.csv
Sudan,CPIA quality of budgetary and financial management rating (1=low to 6=high),2019.0,2.5,,,world_bank_SQL.csv
Sudan,CPIA structural policies cluster average (1=low to 6=high),2019.0,2.5,,,world_bank_SQL.csv
Sudan,CPIA business regulatory environment rating (1=low to 6=high),2019.0,2.5,,,world_bank_SQL.csv
Sudan,CPIA equity of public resource use rating (1=low to 6=high),2019.0,2.5,,,world_bank_SQL.csv
Sudan,CPIA social protection rating (1=low to 6=high),2019.0,2.5,,,world_bank_SQL.csv
Sudan,CPIA gender equality rating (1=low to 6=high),2019.0,2.5,,,world_bank_SQL.csv
Sudan,CPIA financial sector rating (1=low to 6=high),2019.0,2.5,,,world_bank_SQL.csv
Sudan,CPIA fiscal policy rating (1=low to 6=high),2019.0,2.5,,,world_bank_SQL.csv
Sudan,CPIA trade rating (1=low to 6=high),2019.0,2.5,,,world_bank_SQL.csv
Sudan,Primary school starting age (years),2019.0,6.0,,,world_bank_SQL.csv
Sudan,"Primary education, duration (years)",2019.0,6.0,,,world_bank_SQL.csv
Sudan,Procedures to register property (number),2019.0,6.0,,,world_bank_SQL.csv
Sudan,Aquaculture production (metric tons),2018.0,10000.0,,,world_bank_SQL.csv
Sudan,"Multilateral debt service (TDS, current US$)",2018.0,25500782.0,,,world_bank_SQL.csv
Sudan,Short-term debt (% of total external debt),2018.0,25.121,,,world_bank_SQL.csv
Sudan,"Children out of school, male (% of male primary school age)",2018.0,30.52712059,,,world_bank_SQL.csv
Sudan,Fixed telephone subscriptions (per 100 people),2018.0,0.327554973,,,world_bank_SQL.csv
Sudan,Gross capital formation (constant 2015 US$),2018.0,9190126403.0,,,world_bank_SQL.csv
Sudan,"Net official flows from UN agencies, FAO (current US$)",2018.0,90934.59696,,,world_bank_SQL.csv
Sudan,"School enrollment, primary (gross), gender parity index (GPI)",2018.0,0.9316499829,,,world_bank_SQL.csv
Sudan,"Survival to age 65, female (% of cohort)",2018.0,69.5758718,,,world_bank_SQL.csv
Sudan,Terms of trade adjustment (constant LCU),2018.0,883476740.5,,,world_bank_SQL.csv
Sudan,Adults (ages 15-49) newly infected with HIV,2018.0,2900.0,,,world_bank_SQL.csv
Sudan,Arable land (hectares per person),2018.0,0.474220897,,,world_bank_SQL.csv
Sudan,Claims on other sectors of the domestic economy (annual growth as % of broad money),2018.0,34.24976656,,,world_bank_SQL.csv
Sudan,Final consumption expenditure (constant LCU),2018.0,22158448500.0,,,world_bank_SQL.csv
Sudan,"Probability of dying among adolescents ages 15-19 years (per 1,000)",2018.0,11.0,,,world_bank_SQL.csv
Sudan,"Time to import, documentary compliance (hours)",2018.0,132.0,,,world_bank_SQL.csv
Sudan,"Transport services (% of service exports, BoP)",2018.0,27.09397037,,,world_bank_SQL.csv
Sudan,Adjusted savings: mineral depletion (% of GNI),2018.0,0.0001411164243,,,world_bank_SQL.csv
Sudan,Agricultural nitrous oxide emissions (thousand metric tons of CO2 equivalent),2018.0,28150.0,,,world_bank_SQL.csv
Sudan,Arms imports (SIPRI trend indicator values),2018.0,34000000.0,,,world_bank_SQL.csv
Sudan,Gross savings (current US$),2018.0,9907615247.0,,,world_bank_SQL.csv
Sudan,Households and NPISHs Final consumption expenditure (constant LCU),2018.0,19296183500.0,,,world_bank_SQL.csv
Sudan,"International tourism, receipts (current US$)",2018.0,1043000000.0,,,world_bank_SQL.csv
Sudan,Land area (sq. km),2018.0,1849233.715,,,world_bank_SQL.csv
Sudan,Merchandise imports from low- and middle-income economies within region (% of total merchandise imports),2018.0,3.7634204,,,world_bank_SQL.csv
Sudan,"Mortality rate, under-5, male (per 1,000 live births)",2018.0,65.1,,,world_bank_SQL.csv
Sudan,Net primary income (Net income from abroad) (current US$),2018.0,-1812341932.0,,,world_bank_SQL.csv
Sudan,Population in urban agglomerations of more than 1 million (% of total population),2018.0,13.23893823,,,world_bank_SQL.csv
Sudan,Surface area (sq. km),2018.0,1854105.405,,,world_bank_SQL.csv
Sudan,"Unemployment, female (% of female labor force) (modeled ILO estimate)",2018.0,28.63299942,,,world_bank_SQL.csv
Sudan,Adjusted savings: natural resources depletion (% of GNI),2018.0,0.8791902676,,,world_bank_SQL.csv
Sudan,Gross capital formation (% of GDP),2018.0,36.71006393,,,world_bank_SQL.csv
Sudan,Gross national expenditure (constant LCU),2018.0,22295921600.0,,,world_bank_SQL.csv
Sudan,Imports of goods and services (annual % growth),2018.0,2.4000028,,,world_bank_SQL.csv
Sudan,"Industry (including construction), value added (current LCU)",2018.0,273405881500.0,,,world_bank_SQL.csv
Sudan,Population ages 15-64 (% of total population),2018.0,55.91004761,,,world_bank_SQL.csv
Sudan,"Population ages 15-64, female",2018.0,11771161.0,,,world_bank_SQL.csv
Sudan,"Transport services (% of service imports, BoP)",2018.0,66.99227897,,,world_bank_SQL.csv
Sudan,Fixed broadband subscriptions (per 100 people),2018.0,0.075002034,,,world_bank_SQL.csv
Sudan,"Population ages 60-64, female (% of female population)",2018.0,2.030129558,,,world_bank_SQL.csv
Sudan,Commercial service imports (current US$),2018.0,1062981731.0,,,world_bank_SQL.csv
Sudan,Container port traffic (TEU: 20 foot equivalent units),2018.0,451712.0,,,world_bank_SQL.csv
Sudan,Labor tax and contributions (% of commercial profits),2018.0,19.2,,,world_bank_SQL.csv
Sudan,"Population, total",2018.0,41801532.0,,,world_bank_SQL.csv
Sudan,"Suicide mortality rate, male (per 100,000 male population)",2018.0,4.9,,,world_bank_SQL.csv
Sudan,CO2 emissions (kg per PPP $ of GDP),2018.0,0.107993422,,,world_bank_SQL.csv
Sudan,"Cost of business start-up procedures, male (% of GNI per capita)",2018.0,20.9,,,world_bank_SQL.csv
Sudan,GDP per capita (current US$),2018.0,740.746767,,,world_bank_SQL.csv
Sudan,Import volume index (2000 = 100),2018.0,350.5166461,,,world_bank_SQL.csv
Sudan,"Labor force participation rate for ages 15-24, female (%) (modeled ILO estimate)",2018.0,18.64699936,,,world_bank_SQL.csv
Sudan,"Net bilateral aid flows from DAC donors, Portugal (current US$)",2018.0,230000.0042,,,world_bank_SQL.csv
Sudan,"Net primary income (BoP, current US$)",2018.0,-1812341932.0,,,world_bank_SQL.csv
Sudan,"Population ages 05-09, female (% of female population)",2018.0,13.27425054,,,world_bank_SQL.csv
Sudan,Population in the largest city (% of urban population),2018.0,38.2164366,,,world_bank_SQL.csv
Sudan,"Wage and salaried workers, female (% of female employment) (modeled ILO estimate)",2018.0,35.95999908,,,world_bank_SQL.csv
Sudan,"Computer, communications and other services (% of commercial service exports)",2018.0,2.037561208,,,world_bank_SQL.csv
Sudan,Domestic credit to private sector by banks (% of GDP),2018.0,9.354756033,,,world_bank_SQL.csv
Sudan,"Employment to population ratio, ages 15-24, total (%) (modeled ILO estimate)",2018.0,18.42900085,,,world_bank_SQL.csv
Sudan,Exports of goods and services (constant LCU),2018.0,162498400.0,,,world_bank_SQL.csv
Sudan,GNI: linked series (current LCU),2018.0,1238960329500.0,,,world_bank_SQL.csv
Sudan,"Labor force participation rate, female (% of female population ages 15-64) (modeled ILO estimate)",2018.0,30.34,,,world_bank_SQL.csv
Sudan,Merchandise imports from low- and middle-income economies in South Asia (% of total merchandise imports),2018.0,11.58189776,,,world_bank_SQL.csv
Sudan,Methodology assessment of statistical capacity (scale 0 - 100),2018.0,50.0,,,world_bank_SQL.csv
Sudan,Number of neonatal deaths,2018.0,37478.0,,,world_bank_SQL.csv
Sudan,"Population, female",2018.0,20920586.0,,,world_bank_SQL.csv
Sudan,"Start-up procedures to register a business, male (number)",2018.0,9.0,,,world_bank_SQL.csv
Sudan,Adjusted net national income (current US$),2018.0,26511727444.0,,,world_bank_SQL.csv
Sudan,Adjusted savings: net forest depletion (% of GNI),2018.0,0.4138477995,,,world_bank_SQL.csv
Sudan,GNI per capita (current LCU),2018.0,29639.11298,,,world_bank_SQL.csv
Sudan,"Goods exports (BoP, current US$)",2018.0,3484681534.0,,,world_bank_SQL.csv
Sudan,Gross capital formation (constant LCU),2018.0,137473100.0,,,world_bank_SQL.csv
Sudan,Gross value added at basic prices (GVA) (constant LCU),2018.0,21030470900.0,,,world_bank_SQL.csv
Sudan,Net barter terms of trade index (2000 = 100),2018.0,188.8592102,,,world_bank_SQL.csv
Sudan,Net secondary income (Net current transfers from abroad) (current LCU),2018.0,15957438100.0,,,world_bank_SQL.csv
Sudan,Nitrous oxide emissions in energy sector (thousand metric tons of CO2 equivalent),2018.0,940.0,,,world_bank_SQL.csv
Sudan,Primary government expenditures as a proportion of original approved budget (%),2018.0,122.4349302,,,world_bank_SQL.csv
Sudan,Ratio of female to male labor force participation rate (%) (modeled ILO estimate),2018.0,42.48903836,,,world_bank_SQL.csv
Sudan,Broad money (% of GDP),2018.0,32.73487351,,,world_bank_SQL.csv
Sudan,CO2 emissions (kg per 2017 PPP $ of GDP),2018.0,0.1105863237,,,world_bank_SQL.csv
Sudan,"External health expenditure per capita, PPP (current international $)",2018.0,15.60215976,,,world_bank_SQL.csv
Sudan,Insurance and financial services (% of commercial service imports),2018.0,6.744776435,,,world_bank_SQL.csv
Sudan,"Population ages 10-14, female (% of female population)",2018.0,12.13310182,,,world_bank_SQL.csv
Sudan,"Population ages 70-74, male (% of male population)",2018.0,0.9394066725,,,world_bank_SQL.csv
Sudan,Statistical performance indicators (SPI): Pillar 5 data infrastructure score (scale 0-100),2018.0,15.0,,,world_bank_SQL.csv
Sudan,"Unemployment, youth male (% of male labor force ages 15-24) (modeled ILO estimate)",2018.0,27.93099976,,,world_bank_SQL.csv
Sudan,Adjusted net national income per capita (current US$),2018.0,634.2286078,,,world_bank_SQL.csv
Sudan,Agricultural land (sq. km),2018.0,681861.6,,,world_bank_SQL.csv
Sudan,"Time to export, border compliance (hours)",2018.0,180.0,,,world_bank_SQL.csv
Sudan,Women Business and the Law Index Score (scale 1-100),2018.0,29.375,,,world_bank_SQL.csv
Sudan,Adjusted net national income (annual % growth),2018.0,-14.24477665,,,world_bank_SQL.csv
Sudan,Final consumption expenditure (current LCU),2018.0,833843150000.0,,,world_bank_SQL.csv
Sudan,Prevalence of moderate or severe food insecurity in the population (%),2018.0,48.9,,,world_bank_SQL.csv
Sudan,Adjusted savings: particulate emission damage (current US$),2018.0,661719271.3,,,world_bank_SQL.csv
Sudan,"Adolescents out of school, female (% of female lower secondary school age)",2018.0,35.4924202,,,world_bank_SQL.csv
Sudan,"Human capital index (HCI), female, lower bound (scale 0-1)",2018.0,0.368335247,,,world_bank_SQL.csv
Sudan,"Incidence of malaria (per 1,000 population at risk)",2018.0,46.75192287,,,world_bank_SQL.csv
Sudan,"Industry (including construction), value added (annual % growth)",2018.0,-1.900000049,,,world_bank_SQL.csv
Sudan,"Literacy rate, adult female (% of females ages 15 and above)",2018.0,56.06322861,,,world_bank_SQL.csv
Sudan,"Mortality rate attributed to unintentional poisoning (per 100,000 population)",2018.0,1.9,,,world_bank_SQL.csv
Sudan,"Net bilateral aid flows from DAC donors, Sweden (current US$)",2018.0,38479999.54,,,world_bank_SQL.csv
Sudan,"Population ages 0-14, male",2018.0,8584824.0,,,world_bank_SQL.csv
Sudan,"Prevalence of HIV, male (% ages 15-24)",2018.0,0.1,,,world_bank_SQL.csv
Sudan,Public and publicly guaranteed debt service (% of GNI),2018.0,0.7154723262,,,world_bank_SQL.csv
Sudan,"School enrollment, primary (% gross)",2018.0,78.95290375,,,world_bank_SQL.csv
Sudan,"Service imports (BoP, current US$)",2018.0,1172241043.0,,,world_bank_SQL.csv
Sudan,"Exports of goods and services (BoP, current US$)",2018.0,4995707338.0,,,world_bank_SQL.csv
Sudan,"Households and NPISHs Final consumption expenditure, PPP (current international $)",2018.0,61935634695.0,,,world_bank_SQL.csv
Sudan,"Inflation, consumer prices (annual %)",2018.0,63.29250735,,,world_bank_SQL.csv
Sudan,Merchandise imports from low- and middle-income economies in Latin America & the Caribbean (% of total merchandise imports),2018.0,0.4835592813,,,world_bank_SQL.csv
Sudan,"Net official flows from UN agencies, IFAD (current US$)",2018.0,5503250.122,,,world_bank_SQL.csv
Sudan,"Plant species (higher), threatened",2018.0,17.0,,,world_bank_SQL.csv
Sudan,"Population ages 15-64, male (% of male population)",2018.0,55.55348881,,,world_bank_SQL.csv
Sudan,Procedures to build a warehouse (number),2018.0,16.0,,,world_bank_SQL.csv
Sudan,Domestic general government health expenditure (% of general government expenditure),2018.0,5.82834291,,,world_bank_SQL.csv
Sudan,GDP growth (annual %),2018.0,-2.68093055,,,world_bank_SQL.csv
Sudan,"Internally displaced persons, new displacement associated with conflict and violence (number of cases)",2018.0,41000.0,,,world_bank_SQL.csv
Sudan,"Mortality caused by road traffic injury (per 100,000 population)",2018.0,26.1,,,world_bank_SQL.csv
