country_name,indicator_name,year,value,service_level,residence,source
Sudan,"People using at least basic drinking water services, rural (% of rural population)",2020.0,53.19902707,,,Word_bank_Sudan_sorted.csv
Sudan,"Population, female (% of total population)",2020.0,50.0395434186143,,,Word_bank_Sudan_sorted.csv
Sudan,"Primary education, duration (years)",2020.0,6.0,,,Word_bank_Sudan_sorted.csv
Sudan,"Agriculture, forestry, and fishing, value added (annual % growth)",2020.0,-2.49999903718347,,,Word_bank_Sudan_sorted.csv
Sudan,"Communications, computer, etc. (% of service exports, BoP)",2020.0,11.9568223382471,,,Word_bank_Sudan_sorted.csv
Sudan,Gross fixed capital formation (annual % growth),2020.0,-5.80000320703917,,,Word_bank_Sudan_sorted.csv
Sudan,Gross savings (% of GDP),2020.0,30.2057076492631,,,Word_bank_Sudan_sorted.csv
Sudan,Container port traffic (TEU: 20 foot equivalent units),2020.0,493002.3,,,Word_bank_Sudan_sorted.csv
Sudan,"Net financial flows, IMF nonconcessional (NFL, current US$)",2020.0,-2510307.0,,,Word_bank_Sudan_sorted.csv
Sudan,Population in urban agglomerations of more than 1 million,2020.0,5828858.0,,,Word_bank_Sudan_sorted.csv
Sudan,"Share of tariff lines with specific rates, all products (%)",2020.0,0.4395604,,,Word_bank_Sudan_sorted.csv
Sudan,"Tariff rate, most favored nation, weighted mean, all products (%)",2020.0,25.17,,,Word_bank_Sudan_sorted.csv
Sudan,Adults (ages 15-49) newly infected with HIV,2020.0,3000.0,,,Word_bank_Sudan_sorted.csv
Sudan,"Official exchange rate (LCU per US$, period average)",2020.0,53.9960119047619,,,Word_bank_Sudan_sorted.csv
Sudan,"Population ages 15-64, male",2020.0,12312389.0,,,Word_bank_Sudan_sorted.csv
Sudan,"Population ages 75-79, male (% of male population)",2020.0,0.579679052114832,,,Word_bank_Sudan_sorted.csv
Sudan,"Tariff rate, most favored nation, weighted mean, manufactured products (%)",2020.0,26.8,,,Word_bank_Sudan_sorted.csv
Sudan,"Age dependency ratio, old (% of working-age population)",2020.0,6.49981832824709,,,Word_bank_Sudan_sorted.csv
Sudan,"Communications, computer, etc. (% of service imports, BoP)",2020.0,33.8585345537114,,,Word_bank_Sudan_sorted.csv
Sudan,Imports of goods and services (annual % growth),2020.0,-3.89999901715038,,,Word_bank_Sudan_sorted.csv
Sudan,Number of neonatal deaths,2020.0,37008.0,,,Word_bank_Sudan_sorted.csv
Sudan,"Population ages 35-39, male (% of male population)",2020.0,5.35411149573692,,,Word_bank_Sudan_sorted.csv
Sudan,Current account balance (% of GDP),2020.0,-27.3861594338239,,,Word_bank_Sudan_sorted.csv
Sudan,"Labor force participation rate for ages 15-24, total (%) (modeled ILO estimate)",2020.0,25.1590003967285,,,Word_bank_Sudan_sorted.csv
Sudan,Population ages 65 and above (% of total population),2020.0,3.67412129645974,,,Word_bank_Sudan_sorted.csv
Sudan,CPIA quality of public administration rating (1=low to 6=high),2020.0,2.0,,,Word_bank_Sudan_sorted.csv
Sudan,"CPIA transparency, accountability, and corruption in the public sector rating (1=low to 6=high)",2020.0,1.5,,,Word_bank_Sudan_sorted.csv
Sudan,"GDP per capita, PPP (current international $)",2020.0,4142.44860924087,,,Word_bank_Sudan_sorted.csv
Sudan,Gross capital formation (current US$),2020.0,6809841073.56805,,,Word_bank_Sudan_sorted.csv
Sudan,"People practicing open defecation, urban (% of urban population)",2020.0,1.660885479,,,Word_bank_Sudan_sorted.csv
Sudan,"People using at least basic sanitation services, urban (% of urban population)",2020.0,60.14022363,,,Word_bank_Sudan_sorted.csv
Sudan,Transport services (% of commercial service imports),2020.0,82.4140709993093,,,Word_bank_Sudan_sorted.csv
Sudan,Antiretroviral therapy coverage (% of people living with HIV),2020.0,25.0,,,Word_bank_Sudan_sorted.csv
Sudan,"Exports of goods and services (BoP, current US$)",2020.0,5065438285.07997,,,Word_bank_Sudan_sorted.csv
Sudan,GNI per capita (constant LCU),2020.0,424.592544689247,,,Word_bank_Sudan_sorted.csv
Sudan,Imports of goods and services (constant LCU),2020.0,1114656800.0,,,Word_bank_Sudan_sorted.csv
Sudan,Monetary Sector credit to private sector (% GDP),2020.0,7.90463834215738,,,Word_bank_Sudan_sorted.csv
Sudan,"Mortality rate, infant, male (per 1,000 live births)",2020.0,44.3,,,Word_bank_Sudan_sorted.csv
Sudan,External balance on goods and services (constant LCU),2020.0,-932260400.0,,,Word_bank_Sudan_sorted.csv
Sudan,"Imports of goods, services and primary income (BoP, current US$)",2020.0,12054131738.2762,,,Word_bank_Sudan_sorted.csv
Sudan,"Personal remittances, paid (current US$)",2020.0,199517746.225581,,,Word_bank_Sudan_sorted.csv
Sudan,Price level ratio of PPP conversion factor (GDP) to market exchange rate,2020.0,0.11742301768013,,,Word_bank_Sudan_sorted.csv
Sudan,Commercial service exports (current US$),2020.0,1257205172.67535,,,Word_bank_Sudan_sorted.csv
Sudan,"Foreign direct investment, net outflows (% of GDP)",2020.0,0.0,,,Word_bank_Sudan_sorted.csv
Sudan,Gross fixed capital formation (current LCU),2020.0,1295912756300.0,,,Word_bank_Sudan_sorted.csv
Sudan,"Net capital account (BoP, current US$)",2020.0,143593535.04592,,,Word_bank_Sudan_sorted.csv
Sudan,"Primary income receipts (BoP, current US$)",2020.0,61328145.6566224,,,Word_bank_Sudan_sorted.csv
Sudan,"Probability of dying among children ages 5-9 years (per 1,000)",2020.0,5.6,,,Word_bank_Sudan_sorted.csv
Sudan,"Debt service (PPG and IMF only, % of exports of goods, services and primary income)",2020.0,2.82952073124108,,,Word_bank_Sudan_sorted.csv
Sudan,Fixed broadband subscriptions (per 100 people),2020.0,0.065638508,,,Word_bank_Sudan_sorted.csv
Sudan,People practicing open defecation (% of population),2020.0,24.00786171,,,Word_bank_Sudan_sorted.csv
Sudan,"Population, male (% of total population)",2020.0,49.9604565813857,,,Word_bank_Sudan_sorted.csv
Sudan,"Employment to population ratio, 15+, female (%) (modeled ILO estimate)",2020.0,19.4109992980957,,,Word_bank_Sudan_sorted.csv
Sudan,Export value index (2000 = 100),2020.0,210.4706371,,,Word_bank_Sudan_sorted.csv
Sudan,"External debt stocks, total (DOD, current US$)",2020.0,22953534423.5,,,Word_bank_Sudan_sorted.csv
Sudan,Lower secondary school starting age (years),2020.0,12.0,,,Word_bank_Sudan_sorted.csv
Sudan,"Population ages 00-04, female (% of female population)",2020.0,14.2341842169715,,,Word_bank_Sudan_sorted.csv
Sudan,"Population ages 70-74, male (% of male population)",2020.0,0.972675996739899,,,Word_bank_Sudan_sorted.csv
Sudan,"Multilateral debt service (TDS, current US$)",2020.0,27555475.8,,,Word_bank_Sudan_sorted.csv
Sudan,"Population ages 0-14, female",2020.0,8605091.0,,,Word_bank_Sudan_sorted.csv
Sudan,"Population ages 0-14, total",2020.0,17451732.0,,,Word_bank_Sudan_sorted.csv
Sudan,Exports of goods and services (constant LCU),2020.0,182396400.0,,,Word_bank_Sudan_sorted.csv
Sudan,GNI (current LCU),2020.0,3778825610700.0,,,Word_bank_Sudan_sorted.csv
Sudan,"ICT service exports (BoP, current US$)",2020.0,9993002.17558821,,,Word_bank_Sudan_sorted.csv
Sudan,"International tourism, receipts for travel items (current US$)",2020.0,689000000.0,,,Word_bank_Sudan_sorted.csv
Sudan,"Mortality rate, infant, female (per 1,000 live births)",2020.0,35.2,,,Word_bank_Sudan_sorted.csv
Sudan,Population growth (annual %),2020.0,2.39107177389208,,,Word_bank_Sudan_sorted.csv
Sudan,"Tariff rate, applied, weighted mean, all products (%)",2020.0,0.0,,,Word_bank_Sudan_sorted.csv
Sudan,GDP deflator (base year varies by country),2020.0,20225.3192595156,,,Word_bank_Sudan_sorted.csv
Sudan,Gross capital formation (% of GDP),2020.0,31.927451385654,,,Word_bank_Sudan_sorted.csv
Sudan,Gross national expenditure (current LCU),2020.0,4055402678200.0,,,Word_bank_Sudan_sorted.csv
Sudan,"Households and NPISHs Final consumption expenditure, PPP (current international $)",2020.0,51526045087.7568,,,Word_bank_Sudan_sorted.csv
Sudan,Human capital index (HCI) (scale 0-1),2020.0,0.377445191144943,,,Word_bank_Sudan_sorted.csv
Sudan,"Human capital index (HCI), upper bound (scale 0-1)",2020.0,0.39090895652771,,,Word_bank_Sudan_sorted.csv
Sudan,Mobile cellular subscriptions,2020.0,35195207.0,,,Word_bank_Sudan_sorted.csv
Sudan,"Services, value added (constant 2015 US$)",2020.0,23939417749.7469,,,Word_bank_Sudan_sorted.csv
Sudan,"Agriculture, forestry, and fishing, value added (current US$)",2020.0,4341812238.04519,,,Word_bank_Sudan_sorted.csv
Sudan,Merchandise exports (current US$),2020.0,3803000000.0,,,Word_bank_Sudan_sorted.csv
Sudan,"Agriculture, forestry, and fishing, value added (% of GDP)",2020.0,20.3562752284898,,,Word_bank_Sudan_sorted.csv
Sudan,"Net financial flows, IDA (NFL, current US$)",2020.0,0.0,,,Word_bank_Sudan_sorted.csv
Sudan,"Population ages 80 and above, male (% of male population)",2020.0,0.433412705676351,,,Word_bank_Sudan_sorted.csv
Sudan,Refugee population by country or territory of origin,2020.0,787755.0,,,Word_bank_Sudan_sorted.csv
Sudan,GNI per capita (constant 2015 US$),2020.0,1046.85782797939,,,Word_bank_Sudan_sorted.csv
Sudan,Gross domestic income (constant LCU),2020.0,21278468280.387,,,Word_bank_Sudan_sorted.csv
Sudan,Gross national expenditure (constant 2015 US$),2020.0,40601612399.3434,,,Word_bank_Sudan_sorted.csv
Sudan,"Population ages 50-54, female (% of female population)",2020.0,3.31692581533457,,,Word_bank_Sudan_sorted.csv
Sudan,"Agriculture, forestry, and fishing, value added (constant 2015 US$)",2020.0,15975594611.6031,,,Word_bank_Sudan_sorted.csv
Sudan,Claims on central government (annual growth as % of broad money),2020.0,37.3857293024307,,,Word_bank_Sudan_sorted.csv
Sudan,Fixed telephone subscriptions,2020.0,129408.0,,,Word_bank_Sudan_sorted.csv
Sudan,GDP (constant 2015 US$),2020.0,49449888025.3069,,,Word_bank_Sudan_sorted.csv
Sudan,"Share of tariff lines with specific rates, primary products (%)",2020.0,1.219512,,,Word_bank_Sudan_sorted.csv
Sudan,Claims on other sectors of the domestic economy (annual growth as % of broad money),2020.0,23.2292058403764,,,Word_bank_Sudan_sorted.csv
Sudan,"External debt stocks, public and publicly guaranteed (PPG) (DOD, current US$)",2020.0,16584378822.4,,,Word_bank_Sudan_sorted.csv
Sudan,General government final consumption expenditure (constant 2015 US$),2020.0,8440629068.43999,,,Word_bank_Sudan_sorted.csv
Sudan,"GNI, PPP (constant 2017 international $)",2020.0,160045287138.296,,,Word_bank_Sudan_sorted.csv
Sudan,"Unemployment, total (% of total labor force) (modeled ILO estimate)",2020.0,19.6490001678467,,,Word_bank_Sudan_sorted.csv
Sudan,Urban population (% of total population),2020.0,35.253,,,Word_bank_Sudan_sorted.csv
Sudan,CPIA gender equality rating (1=low to 6=high),2020.0,2.5,,,Word_bank_Sudan_sorted.csv
Sudan,"Population ages 55-59, male (% of male population)",2020.0,2.49762008499908,,,Word_bank_Sudan_sorted.csv
Sudan,Population in the largest city (% of urban population),2020.0,37.7072648188988,,,Word_bank_Sudan_sorted.csv
Sudan,"Services, value added (annual % growth)",2020.0,-3.04213515228933,,,Word_bank_Sudan_sorted.csv
Sudan,Battle-related deaths (number of people),2020.0,45.0,,,Word_bank_Sudan_sorted.csv
Sudan,External balance on goods and services (current LCU),2020.0,3527191200.0,,,Word_bank_Sudan_sorted.csv
Sudan,General government final consumption expenditure (current LCU),2020.0,1140083230300.0,,,Word_bank_Sudan_sorted.csv
Sudan,Gross domestic savings (% of GDP),2020.0,32.0143428619289,,,Word_bank_Sudan_sorted.csv
Sudan,Gross national expenditure (% of GDP),2020.0,99.9131085237251,,,Word_bank_Sudan_sorted.csv
Sudan,"Labor force, female (% of total labor force)",2020.0,29.9313112095109,,,Word_bank_Sudan_sorted.csv
Sudan,Women's share of population ages 15+ living with HIV (%),2020.0,47.8,,,Word_bank_Sudan_sorted.csv
Sudan,"Incidence of HIV, all (per 1,000 uninfected population)",2020.0,0.09,,,Word_bank_Sudan_sorted.csv
Sudan,Risk of catastrophic expenditure for surgical care (% of people at risk),2020.0,71.1,,,Word_bank_Sudan_sorted.csv
Sudan,CPIA equity of public resource use rating (1=low to 6=high),2020.0,2.5,,,Word_bank_Sudan_sorted.csv
Sudan,CPIA quality of budgetary and financial management rating (1=low to 6=high),2020.0,2.5,,,Word_bank_Sudan_sorted.csv
Sudan,Gross fixed capital formation (% of GDP),2020.0,31.927451385654,,,Word_bank_Sudan_sorted.csv
Sudan,"Labor force participation rate, total (% of total population ages 15+) (modeled ILO estimate)",2020.0,47.6430015563965,,,Word_bank_Sudan_sorted.csv
Sudan,"Computer, communications and other services (% of commercial service exports)",2020.0,11.5604678076207,,,Word_bank_Sudan_sorted.csv
Sudan,Domestic credit to private sector by banks (% of GDP),2020.0,7.90463834215738,,,Word_bank_Sudan_sorted.csv
Sudan,"Population ages 0-14, female (% of female population)",2020.0,39.2174879069677,,,Word_bank_Sudan_sorted.csv
Sudan,"Population ages 65 and above, total",2020.0,1611075.0,,,Word_bank_Sudan_sorted.csv
Sudan,"Tariff rate, applied, simple mean, all products (%)",2020.0,0.0,,,Word_bank_Sudan_sorted.csv
Sudan,Forest area (% of land area),2020.0,9.92819341929422,,,Word_bank_Sudan_sorted.csv
Sudan,Households and NPISHs Final consumption expenditure (current US$),2020.0,8509756655.80662,,,Word_bank_Sudan_sorted.csv
Sudan,"Insurance and financial services (% of service imports, BoP)",2020.0,6.68049751167804,,,Word_bank_Sudan_sorted.csv
Sudan,"Services, value added (% of GDP)",2020.0,36.3065123809434,,,Word_bank_Sudan_sorted.csv
Sudan,Travel services (% of commercial service exports),2020.0,54.8214536376395,,,Word_bank_Sudan_sorted.csv
Sudan,"Charges for the use of intellectual property, payments (BoP, current US$)",2020.0,1642.29069147505,,,Word_bank_Sudan_sorted.csv
Sudan,"Human capital index (HCI), lower bound (scale 0-1)",2020.0,0.36208176612854,,,Word_bank_Sudan_sorted.csv
Sudan,Imports of goods and services (constant 2015 US$),2020.0,624972382.056909,,,Word_bank_Sudan_sorted.csv
Sudan,"Labor force participation rate, male (% of male population ages 15+) (modeled ILO estimate)",2020.0,67.4710006713867,,,Word_bank_Sudan_sorted.csv
Sudan,"Prevalence of HIV, total (% of population ages 15-49)",2020.0,0.2,,,Word_bank_Sudan_sorted.csv
Sudan,CPIA macroeconomic management rating (1=low to 6=high),2020.0,1.5,,,Word_bank_Sudan_sorted.csv
Sudan,"Incidence of HIV, ages 15-49 (per 1,000 uninfected population ages 15-49)",2020.0,0.15,,,Word_bank_Sudan_sorted.csv
Sudan,Mobile cellular subscriptions (per 100 people),2020.0,80.26408427,,,Word_bank_Sudan_sorted.csv
Sudan,Ratio of female to male labor force participation rate (%) (modeled ILO estimate),2020.0,41.8327875688962,,,Word_bank_Sudan_sorted.csv
Sudan,"Unemployment, youth female (% of female labor force ages 15-24) (modeled ILO estimate)",2020.0,45.1510009765625,,,Word_bank_Sudan_sorted.csv
Sudan,GDP: linked series (current LCU),2020.0,4058929541999.99,,,Word_bank_Sudan_sorted.csv
Sudan,General government final consumption expenditure (constant LCU),2020.0,2398805700.0,,,Word_bank_Sudan_sorted.csv
Sudan,GNI (constant LCU),2020.0,18618072707.4733,,,Word_bank_Sudan_sorted.csv
Sudan,"GNI, PPP (current international $)",2020.0,169108261401.17,,,Word_bank_Sudan_sorted.csv
Sudan,Gross value added at basic prices (GVA) (constant LCU),2020.0,19825637200.0,,,Word_bank_Sudan_sorted.csv
Sudan,"Imports of goods and services (BoP, current US$)",2020.0,10519596582.8024,,,Word_bank_Sudan_sorted.csv
Sudan,People with basic handwashing facilities including soap and water (% of population),2020.0,12.51129099,,,Word_bank_Sudan_sorted.csv
Sudan,"Share of tariff lines with international peaks, manufactured products (%)",2020.0,0.0,,,Word_bank_Sudan_sorted.csv
Sudan,"Share of tariff lines with international peaks, primary products (%)",2020.0,0.0,,,Word_bank_Sudan_sorted.csv
Sudan,"Tariff rate, applied, weighted mean, manufactured products (%)",2020.0,0.0,,,Word_bank_Sudan_sorted.csv
Sudan,"PPG, IDA (DOD, current US$)",2020.0,1233772000.0,,,Word_bank_Sudan_sorted.csv
Sudan,Taxes less subsidies on products (constant LCU),2020.0,242918900.0,,,Word_bank_Sudan_sorted.csv
Sudan,Terms of trade adjustment (constant LCU),2020.0,1209912180.38703,,,Word_bank_Sudan_sorted.csv
Sudan,Trade (% of GDP),2020.0,0.784630821265929,,,Word_bank_Sudan_sorted.csv
Sudan,Final consumption expenditure (% of GDP),2020.0,67.9856571380711,,,Word_bank_Sudan_sorted.csv
Sudan,"Net financial flows, RDB concessional (NFL, current US$)",2020.0,0.0,,,Word_bank_Sudan_sorted.csv
Sudan,GDP (constant LCU),2020.0,20068556100.0,,,Word_bank_Sudan_sorted.csv
Sudan,"Human capital index (HCI), female (scale 0-1)",2020.0,0.385359644889831,,,Word_bank_Sudan_sorted.csv
Sudan,"IFC, private nonguaranteed (NFL, current US$)",2020.0,0.0,,,Word_bank_Sudan_sorted.csv
Sudan,"Net financial flows, bilateral (NFL, current US$)",2020.0,-89592526.0,,,Word_bank_Sudan_sorted.csv
Sudan,Urban population,2020.0,15458183.0,,,Word_bank_Sudan_sorted.csv
Sudan,CPIA trade rating (1=low to 6=high),2020.0,2.5,,,Word_bank_Sudan_sorted.csv
Sudan,Exports of goods and services (annual % growth),2020.0,5.00003454016675,,,Word_bank_Sudan_sorted.csv
Sudan,"Labor force participation rate for ages 15-24, female (%) (modeled ILO estimate)",2020.0,16.9750003814697,,,Word_bank_Sudan_sorted.csv
Sudan,Secure Internet servers,2020.0,282.0,,,Word_bank_Sudan_sorted.csv
Sudan,"Service imports (BoP, current US$)",2020.0,1665687788.57963,,,Word_bank_Sudan_sorted.csv
Sudan,"Unemployment, female (% of female labor force) (modeled ILO estimate)",2020.0,31.2269992828369,,,Word_bank_Sudan_sorted.csv
Sudan,CPIA structural policies cluster average (1=low to 6=high),2020.0,2.5,,,Word_bank_Sudan_sorted.csv
Sudan,External debt stocks (% of GNI),2020.0,115.592992394876,,,Word_bank_Sudan_sorted.csv
Sudan,Insurance and financial services (% of commercial service imports),2020.0,9.31735448396388,,,Word_bank_Sudan_sorted.csv
Sudan,Merchandise trade (% of GDP),2020.0,63.9548499952749,,,Word_bank_Sudan_sorted.csv
Sudan,Net secondary income (Net current transfers from abroad) (current US$),2020.0,1085770076.19548,,,Word_bank_Sudan_sorted.csv
Sudan,"Public and publicly guaranteed debt service (% of exports of goods, services and primary income)",2020.0,2.76539378993379,,,Word_bank_Sudan_sorted.csv
Sudan,"Tariff rate, applied, simple mean, manufactured products (%)",2020.0,0.0,,,Word_bank_Sudan_sorted.csv
Sudan,Gross value added at basic prices (GVA) (current LCU),2020.0,3248427351200.0,,,Word_bank_Sudan_sorted.csv
Sudan,Merchandise imports (current US$),2020.0,9838000000.0,,,Word_bank_Sudan_sorted.csv
Sudan,"Personal remittances, received (current US$)",2020.0,495355092.526947,,,Word_bank_Sudan_sorted.csv
Sudan,Adults (ages 15+) and children (ages 0-14) newly infected with HIV,2020.0,3800.0,,,Word_bank_Sudan_sorted.csv
Sudan,Children (ages 0-14) newly infected with HIV,2020.0,660.0,,,Word_bank_Sudan_sorted.csv
Sudan,Commercial service imports (current US$),2020.0,1194289982.84765,,,Word_bank_Sudan_sorted.csv
Sudan,Exports of goods and services (current LCU),2020.0,17687401700.0,,,Word_bank_Sudan_sorted.csv
Sudan,Final consumption expenditure (current LCU),2020.0,2759489921900.0,,,Word_bank_Sudan_sorted.csv
Sudan,"Inflation, GDP deflator (annual %)",2020.0,115.277768539421,,,Word_bank_Sudan_sorted.csv
Sudan,"Population ages 15-64, male (% of male population)",2020.0,56.2022330917624,,,Word_bank_Sudan_sorted.csv
Sudan,"Service exports (BoP, current US$)",2020.0,1262864883.95964,,,Word_bank_Sudan_sorted.csv
Sudan,Total debt service (% of GNI),2020.0,0.745094481364128,,,Word_bank_Sudan_sorted.csv
Sudan,"Exports of goods, services and primary income (BoP, current US$)",2020.0,5126766430.73659,,,Word_bank_Sudan_sorted.csv
Sudan,"Human capital index (HCI), male, lower bound (scale 0-1)",2020.0,0.3515884578228,,,Word_bank_Sudan_sorted.csv
Sudan,"Industry (including construction), value added (% of GDP)",2020.0,23.3688393894274,,,Word_bank_Sudan_sorted.csv
Sudan,Population in largest city,2020.0,5828858.0,,,Word_bank_Sudan_sorted.csv
Sudan,Discrepancy in expenditure estimate of GDP (current LCU),2020.0,-327400.0,,,Word_bank_Sudan_sorted.csv
Sudan,"External debt stocks, short-term (DOD, current US$)",2020.0,5821604417.6,,,Word_bank_Sudan_sorted.csv
Sudan,GDP (current LCU),2020.0,4058929542000.0,,,Word_bank_Sudan_sorted.csv
Sudan,"Internally displaced persons, total displaced by conflict and violence (number of people)",2020.0,2276000.0,,,Word_bank_Sudan_sorted.csv
Sudan,"PPP conversion factor, private consumption (LCU per international $)",2020.0,31.4288955972053,,,Word_bank_Sudan_sorted.csv
Sudan,"Age dependency ratio, young (% of working-age population)",2020.0,70.4083220913094,,,Word_bank_Sudan_sorted.csv
Sudan,CPIA policy and institutions for environmental sustainability rating (1=low to 6=high),2020.0,2.0,,,Word_bank_Sudan_sorted.csv
Sudan,"Foreign direct investment, net inflows (% of GDP)",2020.0,3.36132040515735,,,Word_bank_Sudan_sorted.csv
Sudan,Number of deaths ages 5-9 years,2020.0,6483.0,,,Word_bank_Sudan_sorted.csv
Sudan,"Secondary income receipts (BoP, current US$)",2020.0,1511573304.65339,,,Word_bank_Sudan_sorted.csv
Sudan,"Population ages 40-44, female (% of female population)",2020.0,4.78207658071238,,,Word_bank_Sudan_sorted.csv
Sudan,"Population ages 65-69, male (% of male population)",2020.0,1.42983878201302,,,Word_bank_Sudan_sorted.csv
Sudan,"Foreign direct investment, net (BoP, current US$)",2020.0,-716939710.59488,,,Word_bank_Sudan_sorted.csv
Sudan,Gross capital formation (annual % growth),2020.0,-5.80000320703917,,,Word_bank_Sudan_sorted.csv
Sudan,"Personal remittances, received (% of GDP)",2020.0,2.32243681819195,,,Word_bank_Sudan_sorted.csv
Sudan,Population ages 15-64 (% of total population),2020.0,56.5265115078339,,,Word_bank_Sudan_sorted.csv
Sudan,Present value of external debt (% of GNI),2020.0,32.2301192347003,,,Word_bank_Sudan_sorted.csv
Sudan,Insurance and financial services (% of commercial service exports),2020.0,0.954688181546164,,,Word_bank_Sudan_sorted.csv
Sudan,Net primary income (Net income from abroad) (current LCU),2020.0,-280103931300.0,,,Word_bank_Sudan_sorted.csv
Sudan,"Population ages 45-49, female (% of female population)",2020.0,3.98280482877247,,,Word_bank_Sudan_sorted.csv
Sudan,General government final consumption expenditure (current US$),2020.0,5990978614.29322,,,Word_bank_Sudan_sorted.csv
Sudan,GNI growth (annual %),2020.0,-4.38994219141885,,,Word_bank_Sudan_sorted.csv
Sudan,"Tariff rate, applied, simple mean, primary products (%)",2020.0,0.0,,,Word_bank_Sudan_sorted.csv
Sudan,DEC alternative conversion factor (LCU per US$),2020.0,190.3,,,Word_bank_Sudan_sorted.csv
Sudan,Exports of goods and services (% of GDP),2020.0,0.435765181853457,,,Word_bank_Sudan_sorted.csv
Sudan,General government final consumption expenditure (annual % growth),2020.0,-5.95000094684929,,,Word_bank_Sudan_sorted.csv
Sudan,"Services, value added (constant LCU)",2020.0,7655439500.0,,,Word_bank_Sudan_sorted.csv
Sudan,"Services, value added (current LCU)",2020.0,1473655756700.0,,,Word_bank_Sudan_sorted.csv
Sudan,"Human capital index (HCI), female, upper bound (scale 0-1)",2020.0,0.399785697460175,,,Word_bank_Sudan_sorted.csv
Sudan,Net secondary income (Net current transfers from abroad) (current LCU),2020.0,206622045500.0,,,Word_bank_Sudan_sorted.csv
Sudan,"Share of tariff lines with specific rates, manufactured products (%)",2020.0,0.2717391,,,Word_bank_Sudan_sorted.csv
Sudan,CPIA debt policy rating (1=low to 6=high),2020.0,1.5,,,Word_bank_Sudan_sorted.csv
Sudan,CPIA public sector management and institutions cluster average (1=low to 6=high),2020.0,2.1,,,Word_bank_Sudan_sorted.csv
Sudan,"Debt service on external debt, total (TDS, current US$)",2020.0,147954919.0,,,Word_bank_Sudan_sorted.csv
Sudan,"Incidence of HIV, ages 15-24 (per 1,000 uninfected population ages 15-24)",2020.0,0.1,,,Word_bank_Sudan_sorted.csv
Sudan,"Population ages 20-24, female (% of female population)",2020.0,9.38066921417371,,,Word_bank_Sudan_sorted.csv
Sudan,Final consumption expenditure (constant 2015 US$),2020.0,31961824910.474,,,Word_bank_Sudan_sorted.csv
Sudan,"GDP, PPP (current international $)",2020.0,181643343385.279,,,Word_bank_Sudan_sorted.csv
Sudan,GNI per capita (current LCU),2020.0,86177.6193053526,,,Word_bank_Sudan_sorted.csv
Sudan,"Goods imports (BoP, current US$)",2020.0,8853908794.2228,,,Word_bank_Sudan_sorted.csv
Sudan,"Net financial flows, multilateral (NFL, current US$)",2020.0,-21434000.0,,,Word_bank_Sudan_sorted.csv
Sudan,"Population ages 80 and above, female (% of female population)",2020.0,0.556800404557949,,,Word_bank_Sudan_sorted.csv
Sudan,"Tariff rate, most favored nation, simple mean, primary products (%)",2020.0,27.5,,,Word_bank_Sudan_sorted.csv
Sudan,"Transport services (% of service exports, BoP)",2020.0,32.5170046739581,,,Word_bank_Sudan_sorted.csv
Sudan,"Transport services (% of service imports, BoP)",2020.0,59.090485092708,,,Word_bank_Sudan_sorted.csv
Sudan,CPIA economic management cluster average (1=low to 6=high),2020.0,1.83333333333333,,,Word_bank_Sudan_sorted.csv
Sudan,CPIA social protection rating (1=low to 6=high),2020.0,2.5,,,Word_bank_Sudan_sorted.csv
Sudan,General government final consumption expenditure (% of GDP),2020.0,28.088273484497,,,Word_bank_Sudan_sorted.csv
Sudan,Methodology assessment of statistical capacity (scale 0 - 100),2020.0,40.0,,,Word_bank_Sudan_sorted.csv
Sudan,"Share of tariff lines with international peaks, all products (%)",2020.0,0.0,,,Word_bank_Sudan_sorted.csv
Sudan,Exports as a capacity to import (constant LCU),2020.0,1392308580.38703,,,Word_bank_Sudan_sorted.csv
Sudan,"Population ages 55-59, female (% of female population)",2020.0,2.648959478304,,,Word_bank_Sudan_sorted.csv
Sudan,"Prevalence of overweight (modeled estimate, % of children under 5)",2020.0,2.7,,,Word_bank_Sudan_sorted.csv
Sudan,"Tariff rate, most favored nation, simple mean, all products (%)",2020.0,21.82,,,Word_bank_Sudan_sorted.csv
Sudan,"Travel services (% of service exports, BoP)",2020.0,54.5757633791523,,,Word_bank_Sudan_sorted.csv
